46730f2b42b879b9646b9dfab15e8e390251963a59c95402b9f626c17cfcc636	愛がん動物用飼料の安全性の確保に関する法律
eda0f62db78171eb82d9e18568a882aaca0968f3745a9eeb534ff40f6981f577	愛がん動物用飼料の安全性の確保に関する法律施行規則
3efa0eb246f4dba41d03b20b3b1c7ddc66d2d48d25ec0a3df8c2fd5febfdda63	愛がん動物用飼料の安全性の確保に関する法律施行令
a0945d5463891539f757e10fc5a96f9d33c9b2f03b9996df17aa3c92ceeec762	愛がん動物用飼料の安全性の確保に関する法律第十三条の規定による立入検査等及び報告に関する省令
ddac74a4d7e39dac59c6fbd36097a8bbfdd64d98e21cc7d953bf5c1511705526	愛がん動物用飼料の安全性の確保に関する法律第十六条第一項の規定により地方農政局長に委任する権限を定める省令
17503061de5d910d9685fcbc3a541b9711ee1338315131f0db19612687276537	愛がん動物用飼料の安全性の確保に関する法律第十六条第二項の規定により地方環境事務所長に委任する権限を定める省令
c7ca13d74a32679bb1a9416b069e6e1c681c40aa25039cd5a2607f3317b8ab94	愛がん動物用飼料の安全性の確保に関する法律に係る民間事業者等が行う書面の保存等における情報通信の技術の利用に関する法律施行規則
86d43bee845ff8fdeb2609eff9958e143d28f854dccd0f65fb7ac22947f00ed8	愛玩動物用飼料の成分規格等に関する省令
27f5cb678c06aeb2ffe88023a9c873e46f8a7dde4eb75bd297c2eee262185344	アイヌ文化の振興並びにアイヌの伝統等に関する知識の普及及び啓発に関する法律
03d3e07f67fcfea36d6c5493036109666be924ca0892c2d677a280f4b6dbb09c	アイヌ文化の振興並びにアイヌの伝統等に関する知識の普及及び啓発に関する法律施行規則
9692bfb44f60f0298742403a5a7167b6bc64f509b845c11735f8a0ac41975e6e	アイヌ文化の振興並びにアイヌの伝統等に関する知識の普及及び啓発に関する法律第六条第一項の都道府県を定める政令
e95a37e3a988520118f5443937b4bc74f313c8d9d8029e97e67dc5aaeffdf61e	アイヌ文化の振興並びにアイヌの伝統等に関する知識の普及及び啓発に関する法律附則第三条第二項に規定する北海道旧土人共有財産に係る公告等に関する省令
941eb15e51ae3e852a633a494668f9c72f8cdf4552f6c27af4720f9a7b0c104d	空家等対策の推進に関する特別措置法
344d4c190aee19140c70c49182b472fd28175c61318fe68c4d5b4a614a888138	空家等対策の推進に関する特別措置法施行規則
0d58958d32e92d6d7f8fa5de1e207da7b39c69879a18d24332d0c34aef992c3a	悪臭防止法
297e7c58c7d45e43f3b431b911e23aaca1450400caef30282f0c70bd452ad861	悪臭防止法施行規則
b3466d27d3ad904fdef5f57b4013efe4362c768fdbb26e8850c2a7a5c8a2368e	悪臭防止法施行令　抄
898c1d470a77cd45df5669f2181eeca6981b02063d96ab50d82705c7f3983b3d	悪臭防止法第十三条第二項に規定する指定機関を指定する省令
e7641f5cba7ef602c61659ca43903d804cdfb1ec0cf60f33eb696c5232dc0616	足跡取扱規則
58edc7a41d72a86a45619ff03b367fd1febb9fc774632af7cd7efa986762bd50	芦屋国際文化住宅都市建設法
42afec0f545264f83bb552d6535087fa05fa9d7e1b5d561fd1e2ccdba082f137	アジア開発銀行への加盟に伴う国債の発行等に関する省令
d82488cffc107c43cb5710f89fc68b301e68d2afd6282ca9eb4d15226b540495	アジア開発銀行への加盟に伴う措置に関する法律
95ab60f81ddcbd682297879343b87aab8bc177390714ec6291e9490120610339	アジア太平洋経済協力の枠組みにおいて運用されている商用渡航カードに関する省令
03754b77f016313921cd2fd94e7eab980614ea46a001753db3455bcc1356d769	飛鳥地方における歴史的風土及び文化財の保存等に必要な資金に充てるための寄附金つき郵便葉書等の発行の特例に関する法律
996327037f1241e672268485512f029a03431cbff99798dea9f957f8765f0ff6	飛鳥地方における歴史的風土及び文化財の保存等に必要な資金に充てるための寄附金つき郵便葉書等の発行の特例に関する法律第二条の事業を定める政令
420e3db080085229e131036272ef970b2587ac863d37fd33121e51a0879a53de	明日香村における歴史的風土の保存及び生活環境の整備等に関する特別措置法
fb9425819b99c14173c183f6d9de876a61a6b59889970093d3326ca69242d9f9	明日香村における歴史的風土の保存及び生活環境の整備等に関する特別措置法施行令
1e253ae8a61e131fb49ab1c8e9a1e0a87aef082fddf7ba272956fcfb74c3ded8	熱海国際観光温泉文化都市建設法
a19f05b8a705c42d1dee7602f58b356aa67f8291deddec3fcbbaf5c2564713c3	アフガニスタン難民救援国際平和協力隊の設置等に関する政令
a40a79047c5172ba8e29d7b326f73eac62fc8acc5328db3cef1f4aced3bdcdd2	アフリカ開発基金への参加に伴う国債の発行等に関する省令
562ef91f9b29b77a4c8949a1fba9f5f796fbd6cbc6f86e2315a410ba1296997c	アフリカ開発基金への参加に伴う措置に関する法律
e240bd36949e31d8622e7c040523a323bdfb41364f133fb4e733c77139b1e0db	アフリカ開発銀行への加盟に伴う国債の発行等に関する省令
048056ac6b9f6149989d3c2fd82f1ae28228419ab8d0c355f627b68c7aeefa0f	アフリカ開発銀行への加盟に伴う措置に関する法律
0b87cbc5f645b63dcaba863328b3e8f1e6009086a8effbe7f48c393a34c4899e	油又は有害液体物質による海洋の汚染の防止のために使用する薬剤の技術上の基準を定める省令
8e638facf988e72f4a22222b07043e10dc15087cd72d41569691db9b1ada094b	あへんの売渡価格を定める政令
8164757919339226154994818e1d056d91c8d2bdf95022e5b5ddecdd09f149d1	あへん法
cc8392a250c9fa944b6c991a6729fc9dadc45c1ea9a4fe1b6b91b05d881ce085	あへん法施行規則
2ff23d000d2f09cae1413545719167a2d65a856214e7f6c855664a990d5f2af8	あへん法施行令
4e92f57b3cc5685ac0f74a9ec29c3d4123edf38f2a7c946fa1ca3df02de00d8d	奄美群島振興開発特別措置法
9455ab95b45fd6c264fbb22bc6a42fe509a810dbd7fee8b1081e09f3d551c145	奄美群島振興開発特別措置法施行規則
b69b7437b1be2188a01c0cf316c434ca8412f475dea06bdaa4fe86e5ced4d326	奄美群島振興開発特別措置法施行令
953cdcf309e6a79963684826eb0b0592adae12ea9ea31884ceafddc2c59c24ff	奄美群島振興開発特別措置法施行令第一条第五項の額の算定に関する省令
672f81f1fe72a1057f7075ecc835db67d9e225e008bb1b7c2a173a29ef133c8d	奄美群島振興開発特別措置法第三十八条の地方税の課税免除又は不均一課税に伴う措置が適用される場合等を定める省令
e506d182feafd9cda3f2a383012c2d306d49d20a18f7c357a77293efa56adf2d	奄美群島における自動車抵当法及び道路交通事業抵当法の施行に関する政令
1de2b5e0014b64b70b26d062ca67df114f04c21d5b5d62b8e264e07ff4960e7a	奄美群島の復帰に伴う運輸省関係法令の適用の暫定措置等に関する政令　抄
162147b6716843fa5a79ed6b53610c9116e1dd596f2ec040e17361def23d8319	奄美群島の復帰に伴う警察消防関係法令の適用の経過措置に関する政令　抄
d39ab9b39409b5d927147b2eb3a9c4d546dccfa1d6cbf768d3928ea125aff712	奄美群島の復帰に伴う建設省関係法律の適用の経過措置に関する政令　抄
b7c04dda55c0167c4fb4ed04390577c42fe5bc047d5396702da166bea4c54643	奄美群島の復帰に伴う厚生省関係法律の適用の経過措置に関する政令　抄
fd6a7e21a5a3fa6042ae0f845f10aa418f1ffd091137b48d1e13d9e177659b5a	奄美群島の復帰に伴う国税関係法令の適用の暫定措置等に関する政令
24e28fae58eea53ce501b0779e39ff148fe9096094572e886ce6eaa0f9c071a5	奄美群島の復帰に伴う自治省関係法令の適用の暫定措置等に関する政令
de0f43ac5111fdea67d911e13a0b3c83f4d45081b785160b140917d7040c41e5	奄美群島の復帰に伴うたばこ専売法等の適用の暫定措置等に関する政令　抄
15da18fa2ab917daa5ad2629e01509b913e9aebbeaafd5132aca7f2b99c83d36	奄美群島の復帰に伴う通貨及び債権等の措置に関する政令
8520dc3129a79dce58333313a237bcd206fa3f5571befe3439e5c7f282287ec8	奄美群島の復帰に伴う通商産業省関係の法律の適用の暫定措置等に関する政令　抄
bb90008e6641bd1eeca838c706f5cde6f2adf156c99dc1cbc1fb8b2d445108c1	奄美群島の復帰に伴う通商産業省関係の法律の適用の暫定措置等に関する政令の施行に伴う金属鉱山等保安規則等の特別措置に関する省令　抄
0972de0d7854a0d92ffb52b0ee5a9c5ed88ad6c208768aaeb82398359683fd82	奄美群島の復帰に伴う通商産業省関係の法律の適用の暫定措置等に関する政令の施行に伴う鉱業権の設定の出願の手続等に関する省令
34eb8660bd434f591a8e0d5a4fdee2fc5eca14789326437d69a8c98da78d4142	奄美群島の復帰に伴う農林省関係法令の適用の暫定措置等に関する政令
0033c2a13709a86754c04bb4f06d107d7164cb20e237192cc7860031578f4905	奄美群島の復帰に伴う法務省関係法令の適用の経過措置等に関する政令
dee81504b2e601e1614a8bfc2d934e71ff623ffe4c24bc6cf4516538dba0811b	奄美群島の復帰に伴う法令の適用の暫定措置等に関する法律
94d74ed4eb0ab92561377b3083b4893118898a5fd258ddeb2d5083fb25ba82b8	奄美群島の復帰に伴う文部省関係法令の適用の暫定措置等に関する政令　抄
5ca4f40f17b5481acb44175733ebaccf8bac368ffa9474998cf061082019c362	奄美群島の復帰に伴う郵政省関係法令の適用の暫定措置等に関する政令　抄
47d105d17c924df175138beaa6a85fc13ca0be607d743ebdbe5fe690249396e9	奄美群島の復帰に伴う琉球政府等の職員の恩給等の特別措置に関する政令
f23ad22bfae2a834884f532ce94384cbf9145cc09eba34d9a928b4c1b4658db6	奄美群島の復帰に伴う琉球政府の職員の引継の暫定措置等に関する政令　抄
0ca72c5e19b5a6f6193b528724088800c0b075d7fd9bc40326eb337d8b7fe5ff	奄美群島の復帰に伴う労働省関係法令の適用の暫定措置等に関する政令　抄
e9616a833ffd17e43f785ba791862b3845088574a8b4a82d1a91fb86f8d9f4b3	雨水の利用の推進に関する法律
f6679a13214e7432a25bc32a8562ef64bf03572be12b58a53923ff8944e4bbac	雨水の利用の推進に関する法律第二条第二項の法人を定める政令
5ce8841a010191966a1204d6372c21b043071b40a8aa984e6ecd67f7160aa622	アメリカ合衆国軍隊等が行う免税軽油の引取りの手続に関する総理府令
a57c01ad0efffbda50d07c4d07c907f00a6f5dc7a15dca99ef4489d8e310d610	アメリカ合衆国軍隊の構成員等の免税輸入物品の譲渡申告書等の様式を定める省令
8758daa55260d6d9e98e0966886be92d9654459c568c4a681afd186dcc28e851	有明海・八代海等総合調査評価委員会令
9194d9b4184a5a53f82179cd45ba677ffb1615620f207c755ec714a7df8c0ac6	有明海及び八代海等を再生するための特別措置に関する法律
63a2bfdfdd555ab7a561e730fce0fa087ba12f9969a57013426e57656a3a3499	有明海及び八代海等を再生するための特別措置に関する法律施行令
6d234c57e955e2734661a14c5f7b05dd046250ba982f3a3fa37691e0d6ca9e9e	アルコール健康障害対策関係者会議令
7e2883c6c3b7cf8917ad3e7f72004a8c1142bc3c4b9c1b682199452bba53cf41	アルコール健康障害対策基本法
7b3c253ee639973b150697723b81e835b4f58b17812943cf4141dfa48ca812bb	アルコール事業法
9732566c7eedd7c397b76a70a7f15ad482bb26ad987e0cceb20fa8ea6a6a8d00	アルコール事業法施行規則
3a276c9422df365d272d00e16508d6a3e563fa8d6eca502f64fd734970d6b139	アルコール事業法施行令
399ab3014824c9001d58b1c3ca4dbdce10403ab0e2b6f2e952059305873ceaf1	アルコール事業法の施行に伴う関係政令の整備に関する政令
6eac95d81013c7c4a336a2cc9e415ec7f688cfbd822c43061b64946a0bbaaf88	アレルギー疾患対策基本法
bb12165166fbb9b600449cd0f2878be1fdf4da0e3c38dac9273c28348b583377	アレルギー疾患対策推進協議会令
8d830a486df61ddd79d97d73fcc6a5d58e4fba66de49084a892e35dec06074e5	泡消火薬剤の技術上の規格を定める省令
5f3e140fa8e91052a914d2f64bb5f1a86fa45ec23a8ce1d4e5b820e712baad55	安全な血液製剤の安定供給の確保等に関する法律
641237262853844032670368f6874deae2884b0d925f88a13985e526116e4212	安全な血液製剤の安定供給の確保等に関する法律施行規則
332d8a2ead0b3ae273b02a3560cb6bb3f6ba1ebf39e53962617e0b17171f4ee0	あん摩マツサージ指圧師、はり師、きゆう師等に関する法律第三条の四第一項及び第三条の二十三第一項に規定する指定試験機関及び指定登録機関を指定する省令
5afd5c28285430e8c8d6c153675673c314cbeb19e5688c0127a4bc39251a6703	あん摩マツサージ指圧師、はり師、きゆう師等に関する法律
f5acd393d91daf6c92cb661544653aaaba1b0e1765b43f69b30668c22f8dfce1	あん摩マツサージ指圧師、はり師、きゆう師等に関する法律施行規則
92fdbe9395be5a35500145cf627ffd686ac961754c98e269e396a49953e80962	あん摩マツサージ指圧師、はり師、きゆう師等に関する法律施行令
530c16cf32839021aabc63b7daed9153331906350d5bb59c6a1d1e45ed12cf5a	あん摩マツサージ指圧師、はり師、きゆう師等に関する法律第十三条の二及びあん摩マツサージ指圧師、はり師、きゆう師等に関する法律施行令第十五条の規定により地方厚生局長及び地方厚生支局長に委任する権限を定める省令
207226b330ed105abfc769cf43aaca2bffb9ac9b5a06ebbf62bba467381779d9	あん摩マツサージ指圧師、はり師、きゆう師等に関する法律に基づく指定試験機関及び指定登録機関に関する省令
eb1d84d67eb8b90581ec1c41ae5ee63fe62e9ed578d932608b7284f9e15aba1d	あん摩マツサージ指圧師、はり師及びきゆう師に係る学校養成施設認定規則
f99ad81469e6cfe4cba89cdffb05aa9a6c9d35315b9e8c1cdc2a3cf94d6f6b31	海外からの日本国民の集団的引揚輸送のための航海命令に関する法律
79d836e9902cd98383025b511095f65992b874b7d29c8858a3811b742487025b	海外交流審議会令
6fbb93a44f7796c1116d59ddfc53c064bb3df69005d68666c7def5496994bd52	海外の美術品等の我が国における公開の促進に関する法律
20c0b5ffd5bb7ef002278e107eaf5f29b46e28b2e80e3aedcaee110657735286	海外の美術品等の我が国における公開の促進に関する法律施行規則
ed34b04adbd03d7a930ad7d16c71090cd97b6537b265af478571f42f1db8b726	海外の美術品等の我が国における公開の促進に関する法律施行令
5d722366c0312efb5326eb46e3f86684c3a8441b081fed5de11690713aa8c257	海外の文化遺産の保護に係る国際的な協力の推進に関する法律
a0abd9b3120abd64ab1ff10a427b13351800ebee953211b8f6d2d3233e42af55	海岸、林地荒廃防止施設、地すべり防止施設及び漁港に関し公共土木施設災害復旧事業費国庫負担法を施行する省令
bb7f585535cd4db1273561fd4b30982540e01b1c117c84a6a819a54d5b585658	海岸法
be723f7816c36da6c4a44116c2debc9c17a9dfd7077f66b555c55407c229cb85	海岸法施行規則
e8ec8f6bb65c95e7f2d39065e493e84f60df9b6d90620710309549b1cf400df1	海岸法施行令
b65d183d3ef6db8128acfb7e58c17d3a96e2d3eceafda6bdfd1c021dbffd6e5b	海岸法第三十七条の二第一項の海岸を指定する政令
64d8705d715a4db9b0943155116ee8370847bdee2ff5e81e4bdff41230988c1b	海岸保全施設の技術上の基準を定める省令
9af1d8770e474916b00665b73180eec64dbe07834c1fa31a3ae6ef3374c72045	海区漁業調整委員会委員の選挙等に関する省令
58bc0ee8957c2ffb29cf3ec198107469666cb44e890ade814b2fc1be12debd71	会計検査院規則の公布に関する規則
4f4e8e5e057cd05f6963fbceef71fa78bd064e043a363510418c5cde0cf06f8a	会計検査院審査規則
8f786009716ec1ed29ed6e44f9329bcf2ffffc4b9687593b8e2d6676a7f9e4f4	会計検査院事務総局事務分掌及び分課規則
6e2e79d65938629f883a9d12a6ad8bda11b4fc8cde3761834d11c89a0ac4ae18	会計検査院事務総局定員規則
ea5ee929d97d4153691cce8c659072d47fd92efaa941a382501cabaabd0161aa	会計検査院情報公開・個人情報保護審査会規則
1fee86627eec85f68bcbcb8775614ab3f447c5d965b0ee9d9510ba18434a628e	会計検査院退職手当審査会規則
e2612bef11f79cdca98e79232d2558f50d58170bd8680757210bfd5ff26cc228	会計検査院懲戒処分要求及び検定規則
f086642189fd7d64db0a231d68aae1ca1c8554dc741c12a669cf4c175366d7d8	会計検査院の情報公開に関する権限又は事務の委任に関する規則
df74fc6097ef5a6a75f3257c3b1788908b86be19f372c3bdbde95b7e008b185d	会計検査院の保有する個人情報の保護に関する権限又は事務の委任に関する規則
74fbad322d8dc88df32da9b4f1029425c7c97fa07588fd96a49c79659af91dc2	会計検査院法
7464287dafa4956dca57b39f4b9e5201d01c717ab597c929526573de097eb1ce	会計検査院法施行規則
10add9d4eafcfd2bbaa0faf63bef25e7bef444904ae2f0760ed06390620aaf13	会計の監査に関する規則
d0d06e5e5ee88d426b50582531e0fb190ff18b7019cb9db1cef013666e95571d	会計法
5499af7abf2a5b8d1ffeb87a29afbaed5f191a1ffd032dbd80af7415569d1e9e	介護・障害福祉従事者の人材確保のための介護・障害福祉従事者の処遇改善に関する法律
d0c1556a7707fd4c275a93eed09d14647c513d8c927de3437e253fdfd778d9b6	介護給付費及び公費負担医療等に関する費用等の請求に関する省令
e4bb191703f8442b83d77e905ee2fa7f7925fdba52be523db857f2408efd8548	介護給付費等の請求に関する省令
a08cc8e8ae4db4b6c95535d83fa5ed8f773b031b91de681e1b61dc0f33e806f7	介護サービスの基盤強化のための介護保険法等の一部を改正する法律の施行に伴う関係政令の整備等及び経過措置に関する政令　抄
2bee36f74348375665cc1fed7d80682f224c3a9e71cabc28a01868a4fec2fe6e	介護保険の医療保険者の納付金の算定等に関する省令
0b7876c6da8dedf92cb288d4fd1050508cadb7d3b420b17f9af27a13c2047f94	介護保険の国庫負担金の算定等に関する政令
2452b344075496346a860bfd71c1f9d23044d5d30ea6dfc65cc24ab2e94e5167	介護保険の調整交付金の交付額の算定に関する省令
01fb150cd14c14abf7d80d5e2e94eda21bf7d44ba72e19a9a5ece37b360a350d	介護保険法
f28afead0b5ae3ed2ce759611674327727c026c69ba0bd99724e42a9b35f12bf	介護保険法及び介護保険法施行法の施行に伴う関係政令の整備等に関する政令　抄
f474596b7373e6028dc621ee486ad260b5093ff614c21f4b17b91cac39fe0d2b	介護保険法施行規則
cf4230c411569c6e369a85cc3e71461843552b279de3669320b5349a51bbec56	介護保険法施行法
0036356bbce68dc24760b49f3e6be4d24b38510b0fab91ff66915e08045ce762	介護保険法施行令
5338d1d4c9f9a2797bfbee71d5452c6f10d01001b149082375dd18ec9077cda2	介護保険法施行令第三十七条第一項第三十三号に掲げる規定として厚生労働大臣が定めるものを定める省令
813d36b434eca1ebe145c9c5e395aad7c6a9166fc04c24904abae088b4cf104c	介護保険法施行令第三十七条第一項第三十四号に掲げる規定として総務大臣、経済産業大臣及び国土交通大臣が定めるものを定める省令
19a9f2189c52eb0b1cdf9c2dd5d3ffb9ba0c531abea6605f6c76ec1475ff4023	介護保険法施行令第三十七条第一項第三十四号に掲げる規定として総務大臣が定めるものを定める省令
1cd8df0325de554c66826515c3fea05778a3cfc3d391da0265a81fbc122d35db	介護保険法施行令第三十七条第一項第三十四号に掲げる規定として文部科学大臣が定めるものを定める省令
0bcd41b5bda6bd6ad431e5d243f4d781ecda799bfe8cb2a58c50c631efea52c9	介護保険法第百二十二条の二第二項に規定する交付金の額の算定に関する省令
7001eab50de67043d79f2f7dc0636cc404cf99a981c77920c87bd86d68cbfdf4	介護老人保健施設の人員、施設及び設備並びに運営に関する基準
e826fcebeed719338b14a923df143b6e2e64e0f758a43c9bb2a97043371f7224	介護労働者の雇用管理の改善等に関する法律
293183a22d6dd7f15957a7b295461826dbc7cfd96330a89f6d1c3ec8bdd751fd	介護労働者の雇用管理の改善等に関する法律施行規則
8f8acef631b83519a71c6475730b51a773becda2d1a482c8c72d4ee2fe5d4d13	介護労働者の雇用管理の改善等に関する法律施行令
b0f8affb416960d71b12d1db5ad8665d82118e04b20e001d1d66136b0089ea23	会社計算規則
784664e19dfe260132d8c976ed41ab54cc9aa9f5b787f64b62d55ae14be7fec5	会社経理応急措置法
49c4420b9172afd5fa8bdb412db4653898f382dd50079a80c01cdb7604c83ce8	会社経理応急措置法施行規則
b5daeb50dd9bc818d9207bed1ae182434d3a58d05f30713bdb20cab94475ade2	会社経理応急措置法施行令
33b03a1fce103bfaa6f644681ca839d3e0c81998066031c153dd65ead5de328d	会社更生法
55811e4ccfcec478969fd1500642060b58d694ade28d60ec2ec994cf22b2bb6a	会社更生法施行規則
704efadd896587dac50dccdbc7e8382c0d22c89758794e7b3d6a89739862861c	会社更生法施行令
a097cf332c973e0e4d43327452d075107d2edc02d45eb67297749e4461a3053d	会社更生法の施行に伴う関係法律の整備に関する法律　抄
3f808136dcb2c58b79f5be8a6135a867762fe6dc023b16c888fdd5cd885792d2	会社等臨時措置法等を廃止する政令　抄
35d79e736ac7ddf7fe4231f6071b8ee44472fd889f2ca4b60c048fa451d2dda2	会社分割に伴う労働契約の承継等に関する法律
9f4e298349aa9b494407742a71f5078eff09c8713c73040221b89bbd87d5fb7d	会社分割に伴う労働契約の承継等に関する法律施行規則
36f7fb8655b13870fa0b99a175201ccaae98193c3d87f77e9369de9da5292a15	会社法
f0d7fe17cbdcfc64ba06e905dead8e30cc7b24061b1d8c2a98b3f07af9d92af3	会社法及び会社法の施行に伴う関係法律の整備等に関する法律の施行に伴う金融庁関係政令等の整備等に関する政令　抄
810e8887bd3dbdb07e511ea9595b3e176d304edd4f2ef382ffa397ff9ef11fa9	会社法及び会社法の施行に伴う関係法律の整備等に関する法律の施行に伴う法務省関係政令の整備等に関する政令　抄
32021f28ba77dfacb9e015307733b5eb80aca075d03da10435ea1dc5457fa62c	会社法施行規則
0c7086204235f4aa3f258b674e2cbd21686e6d2e5cade2d4542781d2529d4a7b	会社法施行令
4a27acbdc09362ba0fe5ac677cab4f080d79af36e1abcb8629b96de3bb2c023a	会社法の一部を改正する法律の施行に伴う関係法律の整備等に関する法律　抄
f8d57e9869260047fd55ad37cf329cd0f5a881178ae0747424cc1a69fbe822c3	会社法の施行に伴う関係法律の整備等に関する法律　抄
82f742d589145abb4cba34adce92e48609ca249e647cbac1341dee00ed76972c	会社法の施行に伴う関係法律の整備等に関する法律第二百三十条第一項に規定する特例旧特定目的会社に関する政令
75adfcf3fd7e9323f845f26fae8bafdd5ba32c1a5711bf6b3c151943e307f769	会社法の施行に伴う関係法律の整備等に関する法律の施行に伴う経過措置を定める政令
3b406da59b5b902cd95c66ea59ff5be00bb04ec0befd5b3ba298838843fc4f7b	会社法の施行に伴う関係法律の整備等に関する法律の特例旧特定目的会社に関する内閣府令
0d832b9367bd32fe3b35239fd2d27c3258fd5daa2bc6166ea1d27acac4c517d1	海事代理士試験規程
c853b754fcd64033cd2c37c27368ab62924c64afea6002370a889b564dc6064a	海事代理士法
0fefc74770a3fe2fd7a7ed1dd22345dbbc404693a549cfcc103cad68193f41ce	海事代理士法関係手数料令
a62b259712668c77cfeb621b3344a74a06c5247f52ba5b80e4ceae37ab0c84f2	海事代理士法施行規則
9b6c05222c536bacd5409996f515ab5cd39c5c909f1b4e97cbdcf4736f1bed63	海上運送法
de7b96beb615dff78939b3b8d29b34372b91a56ab47519821ebf0628cc3de797	海上運送法施行規則
b5eb911f42d34041b91014c697bf6f91af95f9649fa878b5a83f32d21195281d	海上運送法施行令
42da892f8c944bef5b2c066d64915e453c48641a7471b32cb28d3b9a91188367	海上運送法第三十五条の規定に基づく日本船舶・船員確保計画の認定等に関する省令
e03f938c5b20805478e099250ae028ee628e162caecbc582c5c47709efbc040c	海上交通安全法
ef8f06e14c157f3806fddb05c7ba7958a1ef739a18282f53d941d50246b70efe	海上交通安全法施行規則
72f0f977dc256ec3de6d8162fe39eff0e5c273ee0d825346bd484eb6ef014934	海上交通安全法施行令
229793f0f9c5c2d66b48c83a3ba46574b240ad053bbdbb8f1a38a24c12339509	海上衝突予防法
54c16cd1dae8129dfba5069f71acfd8dbdef7131ffc732dd50967d89a4ecd5fe	海上衝突予防法施行規則
c4a857c680adf1d6d4acd0b1254cbf6cbb8a422bfb7b68dba582206199ce460c	海上自衛隊の使用する船舶における火薬類の貯蔵等に関する省令
81e2cbbfb585aee563d29813454bcfb8d57805c01ca470bb7e71003070e33e48	海上における人命の安全のための国際条約等による証書に関する省令
a0c7093753b9f3bfe8eb68fa2548cc5c21b62f75b674bb7d50e15e179677b6f6	海上物流の基盤強化のための港湾法等の一部を改正する法律の一部の施行に伴う関係政令の整備等に関する政令の施行に伴う経過措置に関する省令
99406ad52a7f1ea398d96a27efaa30746328cb486e585de9e5708ee1482541ab	海上保安官に協力援助した者等の災害給付に関する法律
22552b5884ebd7d79880e0a67a1531a956e084597f3cb12bf4900104a7b9cfba	海上保安官に協力援助した者等の災害給付に関する法律施行規則
4390565d88700456a9ca915aa90e9e3e9b2d0b754002801ac07c0b27fbac03d4	海上保安官に協力援助した者等の災害給付に関する法律施行令
78514442edb5606f72377cde5905a10c22d17d2b1be9deaef664c57013faef2f	海上保安学校の名称、位置及び内部組織に関する庁令
edab3ed6e1fb5e0e81f11653cb70fa41819c002a7a1112ac4a068978b01bd53c	海上保安大学校の名称、位置及び内部組織に関する庁令
f7324a27a368b82916155ba8e37b8355c8ce3494daa933d90f1680112809cfb5	海上保安庁職員服制
89543c5cb6a251f91365557f07c1ecd6189d16ae30c874abcf8b76f97ae76446	海上保安庁組織規則
0f6813f784458540d2e32206cffc7313ca793f1d4d175a4ab27257722ffa9ed8	海上保安庁法
