ea311f7e7f8b989d96dc3c8ccb21aaa7309232ebd0f30a262cb8bb23dd85f102	厚生年金保険の保険給付及び国民年金の給付に係る時効の特例等に関する法律施行令
3c8b279aeafe985e061c35bb18391c4928f450c2f2933d328926d7c7d7749665	厚生年金保険の保険給付及び国民年金の給付の支払の遅延に係る加算金の支給に関する法律
4773658458e309182ce742017c6283920abf28daa0b5ccbe9e78d4f47decfcd1	厚生年金保険の保険給付及び国民年金の給付の支払の遅延に係る加算金の支給に関する法律施行規則
beb578507b9e0b925daa6e49f995fdc5784448e3cf533cf1d35b18bcb6772ce2	厚生年金保険の保険給付及び国民年金の給付の支払の遅延に係る加算金の支給に関する法律施行令
57a8577e1bab4be1bb936def2ade834fc3a8d9e4a9603ee51f5aaef64098afa5	厚生年金保険の保険給付及び保険料の納付の特例等に関する法律
663d9499cf553c4e8450c1feb06c0712a3ee9fb5360d0e6510a4f081f9e62ba9	厚生年金保険の保険給付及び保険料の納付の特例等に関する法律施行規則
62dcef2f021c87f95f2defc7b4bdcdea83762339290468bba85eafdb60571f36	厚生年金保険の保険給付及び保険料の納付の特例等に関する法律施行令
fddd58005809ddf046f81f3a04c80c0d1a7200cd570ed61b57b0c955202617ae	厚生年金保険福祉施設資金融通規程
60a42cd085e3e6c0a03ce7f40b438b225aced007b93dd4ee07434b78466f94ce	厚生年金保険法
5dfa26ade5deb5aa7aa1f351c480bc40c913d9e6074384693cf309f75cc692da	厚生年金保険法施行規則
11d3d9e7ef657b753712070047abf93f617340218cb08891ab264670aeaf2081	厚生年金保険法施行令
50ebc0c110e75ae0b2df3e4dfd1b803373e6d7f1f3f17a107d37ee55ea7796b8	厚生年金保険法施行令第三条の十六に規定する総括審議官等の範囲を定める省令
9820ee357d027b2f0c8b8027a889cb3ca13a0edec05c19f7909bba380897fb8d	厚生年金保険法第七十九条の九第一項の報告書に記載すべき事項及びその公表方法を定める省令
7a12bc4c243e2620f2fcf207c86519910dcceb175d8b6b6719ab54c0b7252796	厚生年金保険法等の一部を改正する法律等の施行に伴う存続組合及び指定基金に係る特例業務等に関する省令
ee188d72d2a3fc9ae8f7d229c239af1d5f7a89c00643a7d3e67852019b3afdd1	厚生年金保険法等の一部を改正する法律の施行に伴う経過措置に関する政令
7cb2a2384ec5036b4f6beae2be46cf6ef8ed00e85bdf43d694295094e8cb2564	厚生年金保険法等の一部を改正する法律の施行に伴う国家公務員共済組合法による長期給付等に関する経過措置に関する政令
7b7d168b3efe2701caf2b49e895e40794f5b9bf5b7acfa38fd06017f9f250e4d	厚生年金保険法等の一部を改正する法律附則第三十七条第一項の規定による旧適用法人に係る健康保険組合の設立に必要な事項等を定める政令
668c339f03579c976e1dcb2bb663e2a2919228409d0e0dba1aec9aa760ed2e8d	更生保護委託費支弁基準
785da354c83292dcf3d2eb2f15f086a34acf95514f80ab17d4e5f83263352b35	更生保護施設における処遇の基準等に関する規則
4226354d57b3730a0bff7aea33b76d2813cb8f6c25a5d5775e9f7db27a694b38	更生保護事業費補助金交付規則
3cc25ffdec4f564142aaf216eb9c058ccf75ae4fa2dfdc34bca7d03112a07cb1	更生保護事業法
621cf280f70415d4b442bde2783fbe884f06fd214c5f1ee0c117fc25e3bbccc8	更生保護事業法施行規則
28ebd87e6a517ed5f6550ad5fe4430cc04a0389d68a4cbcdd896155a52c80e7e	更生保護法
50817a059af7c9c2bfa63220b860eccb8eda4c66991fd04f35ac9410446ecb99	更生保護法施行令
49e6f5b122f4f396606b763dcc2e7327ea3e918bb3a76d4b651d03af10221798	鋼製又はアルミニウム製の缶であって、飲料が充てんされたものの表示の標準となるべき事項を定める省令
66bd0d607fe6585a9eb6189378d4b9dab17c64e8606a5e145f11b27c3ee098a9	厚生労働省関係石綿による健康被害の救済に関する法律施行規則
0cd25e3c38779ae2c6ec784d1c6bc5075870dafff9b0dda0d34001fc25260514	厚生労働省関係牛海綿状脳症対策特別措置法施行規則
ae6a2db57e059b211f8f3ed350460ac58efd13002d6577f47c50fe80addb8d32	厚生労働省関係化学物質の審査及び製造等の規制に関する法律施行規則
8981dd6bbcbb163d2bdcb6eefcdf4c2974960f6fbc622f137363f7fe54bb5f0b	厚生労働省関係競争の導入による公共サービスの改革に関する法律施行規則
665db955742fbd8d19c22adecb9d8073823fc4d283334b4abd09fe3029411c41	厚生労働省関係研究開発システムの改革の推進等による研究開発能力の強化及び研究開発等の効率的推進等に関する法律施行規則
6ef60899dfa8277448316695bc4b2d9ad0de2fb22cd30963aa78e57b6e76d48b	厚生労働省関係構造改革特別区域法施行規則
a828c5119bcd02a09f17fe78d01fed3540a8d96f5c758877611642f2bf0bb52a	厚生労働省関係構造改革特別区域法第三十四条に規定する政令等規制事業に係る省令の特例に関する措置を定める省令
eae27983955824ea8f81b08d0651571becd34aaf7b84f03f3c4305136f3915af	厚生労働省関係国家戦略特別区域法施行規則
83a64d82f9b9eb0c0bb70ae4b9f47fc9cb956d30f6097ebf17cf5b82540cadc3	厚生労働省関係国家戦略特別区域法第二十六条に規定する政令等規制事業に係る省令の特例に関する措置を定める命令
e3e2cfc69bafe4e75aa2d61bc1b4a3fbdd237d7496667f00fe02455afbd06ead	厚生労働省関係総合特別区域法第五十三条に規定する政令等規制事業に係る省令の特例に関する措置を定める命令
fb7da1be70d0c0a11d455e10ac76f25512e0126affbec73ba67b0106d6033ca1	厚生労働省関係東日本大震災復興特別区域法施行規則
2c81822412b0aff7948c845a53f481d6ffcf4b1c4b243a54e104aa49d6972fb5	厚生労働省関係東日本大震災復興特別区域法第二条第四項に規定する省令の特例に関する措置及びその適用を受ける復興推進事業を定める命令
39345f120bb1590de34afd93f2c8788ad276cf7b9d4adf4fbd38004337e4d148	厚生労働省国立研究開発法人審議会令
02c59662e9f7195c0c9b1c30fac32b51feb79aea7c34235658acdafa5cca9dfd	厚生労働省所管補助金等交付規則
0309eb8ae07b0002ab3bda2e2485f9f4830558b30180f4b1d5b49773bf81f268	厚生労働省設置法
6cf73f823a819e296f9da5d8682b4cd35c41f023b592fa09fe8d405a4516a179	厚生労働省設置法第十六条第八項の規定による国立ハンセン病療養所の利用に関する省令
000367f589eda1e250bbe7982f7bc1e962bff66dd3254f14bd1dfa2e04f743d5	厚生労働省組織規則
3e0007cecdc9ad2e0c5fd70ec9c7537bb6a7032f6321d921f34a5ee45bd4e85e	厚生労働省組織令
2b3b806a0573c74035b048300b17995864e2a20a7363e17c37a0fb2119b76c43	厚生労働省聴聞手続規則
e8a37b422b2140ad27be8b898ee1a199e8fed7e27cfe39973ede957c5e3ee5dc	厚生労働省定員規則
5bcd7bc93546b6207173a0ad39653dfafd59fa0144bb001b29b5561b56684f9e	厚生労働省の所管する法令に係る行政手続等における情報通信の技術の利用に関する法律施行規則
de5cd08473ce471b10f459fc315103a52f1912fd366a4a984f68259cdcc39d2a	厚生労働省の所管する法令の規定に基づく民間事業者等が行う書面の保存等における情報通信の技術の利用に関する省令
0828c613a973221844a71403b3cddc97ee31944a636e9933a10a97ba8a584b4a	厚生労働省の所管に係る一般会計及び特別会計の歳入について証券をもって納付し得る種目を定める省令
1aed0bd0336872a2b6c1858eb39aa4ac71275ac1e1dc62c9377374593d441e7a	厚生労働省の所管に属する物品の無償貸付及び譲与等に関する省令
c46176f77323cde01c4987757478306f06c70844fd4b5d7939f34afd28983c6f	厚生労働大臣の所管に属する公益信託の引受けの許可及び監督に関する規則
2cef927fcdb9c16faffac1b8194dbb3b7ae01455689b2fcd55e4f13146fdef8c	人事院規則一四―五（公選による公職）
2a0ad1abc5482a4ff036a0812f2b2c5a9b4bdee379a70a552021a663e14fe82a	高速自動車国道の路線を指定する政令
804187167581adcb1868f0a8f3e9e5143097071205a88bdb943cd2f81e9092c1	高速自動車国道法
11c1cfb015a318b08370a2461f1a44d7cd00c62a8a5d59cfd0b75832f72dc186	高速自動車国道法施行規則
09e7354d1b475358230201a125a39240c000ed4489861605bcba117fb036ea39	高速自動車国道法施行令
a9e37759a8221bfecda5a9fbf626a887e33f8f1dc07001eae1b5b30692ad26c0	高速道路株式会社法
286d10f57bb871ed596a6550cc650560ebd11eeb49433e7564c69ed8317f4a1e	高速道路株式会社法施行規則
909849cf1704d5f8f2be7eea6f82f8499ae96dfae299e4477834e57293507932	高速道路株式会社法施行令
b39a08baae06da6013878e9beb75de97aacedc9ec855483d8ec50f8e16d5324e	高速道路事業等会計規則
80b2906f4a155b66e0113e2dec7c5b5ff421d44b83ca112f2067776c761c2022	高速道路における交通警察の運営に関する規則
3d51bfd1e24400a75d460f29b2e900328e0e908002267f3530b1d607c2fc1885	港則法
c355484f7aaeb1bb1240a214e17c39f948ce1a6290dc6fb5afbbd3321cec947d	港則法施行規則
1ceda414c285c3bb168d0aba491c5c24a006850b9552291d8e2aa875e9344a1c	港則法施行令
09daf1525489e52e588c9bcbf0da57395f38e124ce87e6a931f5f63e938f09a8	構造改革特別区域推進本部令
5b8686ea6a715a3bb1f88a9158d9702fd84c978e0ff4559032ea4b3df3aeb542	人事院規則一―三九（構造改革特別区域における人事院規則の特例に関する措置）
340f00dcae56fe13b067e66a1de38b91e289ed32cccf9e5f6f4504e8ee696ec6	構造改革特別区域法
530350d6fc3fe4cde66ee291b419a658fbf0d5b06ce31cc192484372fe925890	構造改革特別区域法施行規則
8352a847b40021987d91bde68783f68abef4faf74fdcfaa60b0e0c247d6e8de1	構造改革特別区域法施行令
10feb952ea5af3e078be6f7df70df21493b5cc808a73d1bea673e9fcd8f32927	構造改革特別区域法第十八条第一項に規定する高度医療の提供を行う病院又は診療所の構造設備、その有する人員等に関する基準
8a20634b044b7dd25ff52e1b9da28d6fa16fc06775c36a81fb811c2019dcb6ad	皇太子徳仁親王の婚姻を記念するための五万円の貨幣の形式等に関する政令
70647c1017f1104140b5afed83a8917fd709225b7216007aa197e533706b903d	皇太子徳仁親王の婚姻を記念するための五万円の貨幣の発行に関する法律
7e2680f9b1eba03cd363a19f1413d8343e1bbc579f57b3176b876bb453f8e52f	交通安全活動推進センターに関する規則
fa99d3524589ddde591a0d68781c08444dbf97fa0c11b950980de74877f9e319	交通安全施設等整備事業の推進に関する法律
7be4dd456cda3056af5a00804a8f56b3768f791def675ef515070f472262b72b	交通安全施設等整備事業の推進に関する法律施行規則
3163378abdafbe41fe61e54f91c0120504cf510159703101b8a10acc383c754f	交通安全施設等整備事業の推進に関する法律施行令
742ffa41af33553f1266ad1a9d938d3e63f307d6f43fbd811f8d14f8c655a1ab	交通安全対策基本法
1cc0ef16b90ddd9c4a15c8d00c355d6430547687a7e21289321a8d32438680b7	交通安全対策基本法施行令
d468d536d512e5b259adc0c39218429d0b03de063e6733fdfc8212fa6054d9a2	交通安全対策特別交付金等に関する政令
26ce002c12560a8b3efc6e57c2962f64564b75c3db8c55f3d3c0c63fdcecc62c	交通安全対策特別交付金の算定に関する省令
b22b7f3088dea1d0c9435cbc6e0a72f6d51932b1c5afd802728ca4dff18d8fae	交通公害に係る大気の汚染、騒音及び振動を定める命令
3405fd21ae674c511aace9b2bfc481b00a060104f69ae8736d8b144878912475	交通事件即決裁判手続法
7c5d2f1db7e1fded82f42a1462ba2c8000920181dc4a8361484f43c87c228a95	交通事故調査分析センターに関する規則
04c4db210e52dc4cd3d8b7e10c7b95ee9fd93fe700b84a1475a653302b370df7	交通巡視員の服制に関する規則
5af72e32cb576a694f990dd1b906d1a49556075f518f8371df472c955e6a4916	交通政策基本法
3bf667b6c8b1cff65dd7916019cdb3c9a9ff1857a7e1799aeeb8b986597d3cdc	交通政策審議会令
41d7d9a24f2032baf30b513b33eef00476db9eb5db8db9c0ff316a0942c1226a	口蹄疫対策特別措置法施行規則
554adf8e45725041442564a0a61f3d454a5214aa25241ef73d5bbfe5cbbf199b	口蹄疫対策特別措置法施行令
17ba78229cd4a7349ee9b30aadcb4ec33add08c2b012b15b042dd00215fdd06d	公的年金制度の健全性及び信頼性の確保のための厚生年金保険法等の一部を改正する法律の一部の施行に伴う関係政令の整備等に関する政令　抄
004d1d267fec418ffaec277a64ab08208fc080bd35170cc6b4269051c8a7ec01	公的年金制度の健全性及び信頼性の確保のための厚生年金保険法等の一部を改正する法律の施行に伴う経過措置に関する政令
bc10382b9d76a1b64239ae1569582d7630897dfa7a422a891c4fcbe394087391	公的年金制度の健全性及び信頼性の確保のための厚生年金保険法等の一部を改正する法律の施行に伴う厚生労働省関係省令の整備等及び経過措置に関する省令　抄
f6873eaa2e6dd24265f070e686ae5e3fb2325d39f27d2186df565b8e05a416d5	高等学校設置基準
46e0157793c7863c0fb225cf41fa05b8071513cd99ee0da4dc035ac64dc35ba0	高等学校卒業程度認定試験規則
27aa2f74da6ac63cf1149bde360d96e31879712b704a829d7235eade484a18f5	高等学校通信教育規程
f4b987581d1c08226406f728b7ed79570095029b726fef5b47b8428c434fc07d	高等学校等就学支援金の支給に関する法律
de648644fc6d51ca00b13f974c37bd50614ec4a51b0408e55e504acb80715ea9	高等学校等就学支援金の支給に関する法律施行規則
22ce4a65c517c5eef1c77165b1d6c28c577d15413d34075c8bbfa4c16296800f	高等学校等就学支援金の支給に関する法律施行令
88c4e45eb0e3a7c7c1ac1ff4320aeffe71fcc8a1d35bdeda009c8c5a0eb621e5	高等学校の定時制教育及び通信教育振興法
e4d9a151b99e7d657c16414e865bbc5337e5d9a4215d1e91216b9fa5e651db6a	高等学校の定時制教育及び通信教育振興法施行令
1641c15ae3d8b69d6560bd7c01401dffba504556e38c1565a99fcb78ed6985e7	高等専門学校設置基準
72357c408852ee141b295aad7c53b165554901591b5005f343a8195ac2822f58	皇統譜令
af2f56fab4e101056c3aa8ac3713f53ea177489bfb2eeceb56cd428c4e440d0b	高度情報通信ネットワーク社会形成基本法
0c601f0fa6d47e68ed4ca9d8e1479114f16df34ac66922188e22c9603a7019c7	高度情報通信ネットワーク社会推進戦略本部令
9cd1df0eac7b31536cb663a8410344afb060e159f0b9a603206def921b419f16	高度専門医療に関する研究等を行う国立研究開発法人に関する法律施行令
4eebfa4f301ef14711a67c8a23770681e67b609f6c2bb698297098849df5f2d5	高度専門医療に関する研究等を行う国立研究開発法人の業務運営、財務及び会計並びに人事管理に関する省令
e338a28a78c3f4142fff88511767a76e98dc289aa6933f0e44e576991564088f	高度専門医療に関する研究等を行う国立研究開発法人に関する法律
656cb79a829c0f1e2fb40dce0dd1cdb7737e4b4bb4920b23521e1c88154c5dc3	高度テレビジョン放送施設整備促進臨時措置法を廃止する法律　抄
2bee7460fccd839a9cc26e743e3c14f827faab6252075643aa0152f3edd930f1	公認会計士・監査審査会事務局組織規則
bdff589cbc1684ae86806049f4ad0f91954bcf82e8473bdef188a496c6e3ced3	公認会計士・監査審査会の職員が検査の際に携帯すべき証票の様式を定める内閣府令
0ac7cc2a87294a1d01088a69ff46dbe8d2de52517ee58aef5449b7c75e51a788	公認会計士・監査審査会令
ec05a3a09787625f2d719f2d5ee112f84e24b4b29ca80ffcbe7ee1d1050241ed	公認会計士試験規則
72d65fc2b6c801e3dcde4fc66e9bb00c597f697c4d4a51bf08c243031eb56086	公認会計士等登録規則
6a07c4d4a600c63930d0d7286bf6cb5b399784ad89b53678a5e57fece9af7e84	公認会計士等の懲戒事件に関する調書の謄本等の交付に関する内閣府令
01b494a1f4b686707cc333aed3a2fe7056e6a1dc9f013001facfa6a067aaeaf6	公認会計士特例試験等に関する法律　抄
b1bb76260bacdf1bea29fb8c87b3cd31b0ec2a10b28e79ec8d805c239b388a57	公認会計士法
d7439d9a9a692b05b8509b36e0fade7d35ab82734b8fe5553f00a1a5a95db983	公認会計士法施行規則
9680200e2c5eae10bde130e1a3ca1d262203f79dc0d9a2c097f43404d25b5f5a	公認会計士法施行令
56177693a406c51a0db55f2a6725de817cfc86caf23facc2709675295997680b	公認会計士法第二十八条に規定する研修に関する内閣府令
df99f6b8f634390a33d3056bae6b95ae660ae7d98c31b807451f3d837d95998f	公認会計士法に基づく課徴金等の納付手続の特例に関する省令
30cfea7abb2a88bcef32f0ae0cec72875bedc8388740f452e3b148bac4812325	公認会計士法の規定による課徴金に関する内閣府令
1081c7c9607e5a334b92875af0382f78ba2ae01cbd2b62a92db5b2ff34c60058	公認会計士法の審判手続における参考人及び鑑定人の旅費及び手当に関する政令
5630ebbbf45795b84888fa6fce1d1b015676632f993bf8f530a37d76a0590ef5	高年齢者等の雇用の安定等に関する法律
af0f750a8440b1a43c7cdb9edf60133fbdd79a2e12168347bfc0748daf725c54	高年齢者等の雇用の安定等に関する法律施行規則
050557bc0853f4127390aaeb6c719f2daf9666a0f44d91b7451dbb213b135ec7	高年齢者等の雇用の安定等に関する法律施行令
a0d3f35ec6de81bf9e8dfe477333f84c7abb5dae01da63d1e9967e707339d5db	交付金の額の特例に係る算定方法に関する内閣府令
7ade66c92174b02a6d143abbde398c91eae4451df495ad765fb87003d33eb360	公文書館法
8b0e4f2435f86ea4bed195eaa9873b7efd1d9c01b46774c7ac97ae123c7e8074	公文書管理委員会令
85cef69478aee0675dd1e45e6eb3fb006ee05b359d55a99e3fec72b0bffca4d7	公文書等の管理に関する法律
846b630e0d49c2ef983ac16feb689532c7a784b520ed5a54482e258323148b3a	公文書等の管理に関する法律施行令
cc826a0c5a5bf2b48cc3ebe7075d7b7b02447d3f018610073c151dbfdc5ead3d	神戸国際港都建設法
eb26dd0ba831e85422a08f52132cd930ef9d167942dc40c6c6927b22fafe54a0	公務員等の懲戒免除等に関する法律
bc3722fbda2927dcaadcc8cbad168b53c4c4152115463bfe6861230939bff870	人事院規則一―二四（公務の活性化のために民間の人材を採用する場合の特例）
804cb0bcdfe97c01cc152c8386d46135d4d9372b908f14a93f2e9bb9fa265c40	公有水面埋立法
608a3f5244271d66c14d60d2160fbd137aa3cbfca82bacbff9d0b68691cc2d63	公有水面埋立法施行規則
7b03400bc76291f2d20af6521779adb9b3e1b1aa17b1a8682a2bb362482250a0	公有水面埋立法施行令
fa1dd960cc96f5ede9b264706c5b776f6ffa038a881b19c1413be9c456e826f5	公有水面の埋立て又は干拓の事業に係る環境影響評価の項目並びに当該項目に係る調査、予測及び評価を合理的に行うための手法を選定するための指針、環境の保全のための措置に関する指針等を定める省令
ce50d3096ed6227e93a67d92f8c8e4bda8f23ac36a43f9b17aee6df385ee52df	公有地の拡大の推進に関する法律
e1a1e0bd7a0e54d5120985459f53153f85b8fc2d20a54a88d9b62ab7c6a6ab6b	公有地の拡大の推進に関する法律施行規則
c88ec4c20c591b27c79615694a7b29244ae76ce506802d672a653e8ffb78ffc7	公有地の拡大の推進に関する法律施行令
f9f7f1807543bee558d3d4ff28b1a2d4470c5b4abef5b805b0ebacce4e22ef85	小売業に属する事業を行う者の容器包装の使用の合理化による容器包装廃棄物の排出の抑制の促進に関する判断の基準となるべき事項を定める省令
8fa3443cc39ddb04119d7b377713641df8858d84258572c108133d091c892e52	小売業に属する事業を行う容器包装多量利用事業者の定期の報告に関する事項を定める省令
1bf0bd9d0e36a6362678c366d44cfcdffe13c110e0498c5ab0013eddf9779941	小売商業調整特別措置法
5281737fa5c72ba2793231e2c2525122f39878d5ebf1566da8e2398f2c5c8153	小売商業調整特別措置法施行規則
c44dfb47a196135216ecc1f8abdec7f9b08f8b2906fd14bd596edb08abbe16a1	小売商業調整特別措置法施行令
426c06824458fc196219d66644ad72ba73cc1563f35ba07a47eae9397de73475	公立学校施設災害復旧費国庫負担法
acb50c8ed7b36296ab937f1fbbe29d7e9e53f06b6be80819ee8a7b918f1b4472	公立学校施設災害復旧費国庫負担法施行規則
e23cb5d3a6eb39dd22f5eae2d6df8926340335b3573b1d710deeb4918eec49ce	公立学校施設災害復旧費国庫負担法施行令
cfb3ba4930a97fa29cbd0f0f5911f9bb40dc614fde6e2ff704354502d14cb62a	公立学校の学校医、学校歯科医及び学校薬剤師の公務災害補償に関する法律
33187d8625f159faa20f206d4022f34e5cf5002cc8427bb354c29a1685ed5d81	公立学校の学校医、学校歯科医及び学校薬剤師の公務災害補償の基準を定める政令
cc739e6b1dc053973526594f25c829be584a3023dfc882af128b2cb94e04c084	公立学校の学校医、学校歯科医及び学校薬剤師の公務災害補償の基準を定める政令施行規則
1af52b3dc37a3df0d03d9932049a5c68e8e387a341ff808527cb95f287d24d99	公立義務教育諸学校の学級編制及び教職員定数の標準に関する法律
259b504ab9689a469b14632af001a00f88e1caa7c9099d866e235cf3122cf05b	公立義務教育諸学校の学級編制及び教職員定数の標準に関する法律施行規則
6af56b5d2db719d4b3e4825e61565e450b0176e1c1f1f7c62f1ffba96f42e4a3	公立義務教育諸学校の学級編制及び教職員定数の標準に関する法律施行令
dc91276a2375173ceb78cafb3d5f6b3179428ffb02a307fac105acd6a663c2d5	公立高等学校の適正配置及び教職員定数の標準等に関する法律
afdc0384999d4d2c0d43ccd0f68e3f6ba9d25e580f0595b212a813e6dd490b78	公立高等学校の適正配置及び教職員定数の標準等に関する法律施行令
8fa1d92545c744a222ea909a837d37ba9dc62f3dcbfaaa3acf75c8ad9e764d88	公立大学に置かれた文部事務官等の身分上の措置に関する法律
3ca5e1583833277ba7e5083389eaae936daf3f0be38884fb0bf64676cb4a317f	公立の学校の事務職員の休職の特例に関する法律
03a7c976dceef224a0a9d83fda53de9632f52f4699fe2b4e12658bb81a88f1fc	公立の義務教育諸学校等の教育職員の給与等に関する特別措置法
0c7569ab8f5782392044314bd200b6932eb43176371a3e1ecc492f8157c474e0	公立の義務教育諸学校等の教育職員を正規の勤務時間を超えて勤務させる場合等の基準を定める政令
5c28fa344ef3c394493302fb938eacad54d174ecd80bb372eafb5f578a0c820f	公立の大学における外国人教員の任用等に関する特別措置法
94530419f38d62e5d128b7ffcf4f086848c2f58a2afc388b40f885c0793c7f31	小売物価統計調査規則
acdea13d1375b7d6d7a4cbf1c632bb8a23c41753ab4ef04b9bfa674a5a0a600d	人事院規則二―一一（交流審査会）
d3776f33fa556d323339f9de65915c147c1c31dbcf94a4efed51181d4d68c782	行旅病人及行旅死亡人取扱法
36aa9318f48a5fedc751077f2e6b4fb3071e61f5e40012fd84d90cd04b5e95f1	高齢者、障害者等の移動等の円滑化の促進に関する法律
39066b605d9a2a121f4c6fdfa19868c8cbd55ed617ab328cff1f32ac6e4ed461	高齢者、障害者等の移動等の円滑化の促進に関する法律施行規則
1cde27e069320425735cb2d93e0994f93eab712b167803ce9d872586d9983426	高齢者、障害者等の移動等の円滑化の促進に関する法律施行令第一条第二号に規定する旅客施設を利用する高齢者及び障害者の人数の算定に関する命令
b1a8183edd38be0d593f60c7c11c235c3ab2e874a37a9a94cd9c64d26a75b98c	高齢者、障害者等の移動等の円滑化の促進に関する法律施行令第十九条に規定する標識に関する省令
9f76eaa4e10c6577d60763456fcac32be32ca53e0d6ff0cd7344a8646a69df3f	高齢者、障害者等の移動等の円滑化の促進に関する法律第三十九条第一項に規定する土地区画整理事業に関する省令
3b1be0e5750a1945833bd0beb3de731967a88e7efe6f6097e93f47f168680197	高齢者、障害者等の移動等の円滑化の促進に関する法律第三十条に規定する公共交通特定事業を定める省令
0c3e3777d57837238d09795a560220bb9f4375f930c0c5f060aeb47677a9533b	高齢者、障害者等の移動等の円滑化の促進に関する法律施行令
412579dacc3ccbc02d25206c1c7688a4ae1b4e7a02bffac4cdfe070845594439	高齢社会対策会議令
73396cd283f0b6172dd55bc6cd7f6ff459d4799122cf974a56073b5f417e76e5	高齢社会対策基本法
64bffa73aadff6c7502ab46807bd7466e3719704fab8a293d629f6238c4f2bed	高齢者虐待の防止、高齢者の養護者に対する支援等に関する法律
116e28c793fe4e4dbd16663cc5e1c0ebe42ddff9a997cb8b236857a9554cc05a	高齢者虐待の防止、高齢者の養護者に対する支援等に関する法律施行規則
46b8d783be722cefac645ebec52171a7ae462ce78f46eed3e77b77091786be1a	高齢者、障害者等が円滑に利用できるようにするために誘導すべき建築物特定施設の構造及び配置に関する基準を定める省令
48884adab63cc91eb466d638ce01b2435f71af215d1f324ab54f2c8b8edace89	高齢者、障害者等の移動等の円滑化の促進に係る信号機等に関する基準を定める規則
85393f21b001f03a5dfa325418ea380d3b7ee879bb197f71ec99e8930b7ac038	高齢者の医療の確保に関する法律
db6862758ed52df1253321c5b288c211ef653248fdeddd14bff61b9b17d35a41	高齢者の医療の確保に関する法律施行規則
36f6bc2f767dd431abad5bab6ee9641f385a9e719ba1116ec7a6532562a0d669	高齢者の医療の確保に関する法律施行令
3aa0237ea056816cb98759bb2f04a1bee1e8317444a7039b56dd2aa1f3cddf37	高齢者の医療の確保に関する法律による保険者の前期高齢者交付金等の額の算定等に関する省令
c35a81f42c4579c8fe3ae710466d23ac3ecea1cdf14201b6b0c3154f24d4689a	高齢者の居住の安定確保に関する法律
92ebb3376800f95a77039b47e1d3eca16dd7059ddbca79fb1b49fc0a19d21026	高齢者の居住の安定確保に関する法律施行規則
8adb775b0f577010bd845f443852e14e6f45795cdaea1c4385f6eaa47c3994f2	高齢者の居住の安定確保に関する法律施行令
0f5f206bb6ab350ec5d2defa51c57439db1772da1112e329a8abab6f586f03a8	航路標識法
8d20a8f30dc9eceae356153a7af7143c31a234efc5c7a08f90501534fb98c11e	航路標識法施行規則
469d209820045af68b18387c21bfc28e5c6ee5ffd73604cc9ccb6c1edcaac488	港湾運送事業抵当登記規則
