91120e40add45d747839ee2f1d88e56dc7fdb2ff58772276bf7fa7f73b916e19	首都圏整備法及び近畿圏整備法の一部を改正する等の法律附則第六条第二項の日を定める政令
746ff55e6565c88fa1e4461b3ac3a3934e45e51829c428b733084e647702db6f	首都圏整備法施行規則
67eb5d9216d6d8f316ac8e18a25931f6d2c8811796e74a6ac288cdc5a1b6f8f4	首都圏整備法施行令
16f083f65fe6f483b6554f8960cf92c4db84a6ecafc7116ddcd727a50ce63bf5	首都圏の近郊整備地帯及び都市開発区域における工業団地造成事業に関する省令
a16d8a25eee1daaa1f1aff35cf51c4053503b79f74a17448a674009d36077931	首都圏の近郊整備地帯及び都市開発区域の整備に関する法律
8b2dcecf4930eac74f6663430c3c2a12c7293d0666dc900c1dd6eef6b56c25b2	首都圏の近郊整備地帯及び都市開発区域の整備に関する法律施行規則
04964f6379ae790e35492689f47e30a5b74092c87e15f0a40c45d7c88c5bdfe1	首都圏の近郊整備地帯及び都市開発区域の整備に関する法律施行令
83fe553c5f1c6d95336b336689d2cb8b17a2637a8f155693361fc80947c3a010	首都直下地震対策特別措置法
132877b8b3cee276fabf672b1ee3d52686218535e912c3ebe401c54e0d27dc15	首都直下地震対策特別措置法施行規則
1e3e24fad5299ee346fcc4d46674d80377005642b4d44a59a78c5cd56ffc0ed9	首都直下地震対策特別措置法施行令
f96fd303887f432944729ec5e158784efff88ab894a7b34754359089f4ec92ca	種苗法
dbd12c831f54885e7d04e5f099706821dcb5a7490d431532d5afc67cb3a539a0	種苗法施行規則
f5cfa1e7264e4bcc7e690fb0ae315a6d1d930d631a4495bbafd84ebe3aa69acc	種苗法施行令
fc381cda51e5b406c22d842d2fa1f1a377b15e2e282df9379daf9a973c65ec7f	主要食糧の需給及び価格の安定に関する法律
65bb80ca2655c6b71af645239ed4ec4190b5420e3ab2c21fc0a0eb900daf0e4e	主要食糧の需給及び価格の安定に関する法律施行規則
66a0a2fe7dc28ce8365f6f4862dbf62a614a38387b31f73a68381706954038ab	主要食糧の需給及び価格の安定に関する法律施行令
305b7803f7d1099b8aa5034f538f9ff3bc00062f428f2abeca26283fce1bf12d	主要食糧の需給及び価格の安定に関する法律等の一部を改正する法律附則第二条第三項の政令で定める日を定める政令
6af3214a6688e600f7632bb2fba3b53743906271581084ebee59745e0f9971a2	主要農作物種子法
a1db01c1b48ccbfa2aee7aac9b5d164fa6d0168015ea542a9d9449220f694df3	主要農作物種子法施行規則
0b6cd000f929e5ea29cdcc9d0fdd30e010cbe36deaa0b00cb0df5a1de3075f2f	手話通訳を行う者の知識及び技能の審査・証明事業の認定に関する省令
20a42842cdcfe3c58f5a54edd594168b9b05ed21a93c4a1c70eef54809c34ae9	消火器の技術上の規格を定める省令
af2a171ae2b1601efe0ae81590d3d5cb9a4c8fb25164d6e9e8a6936569f1ec3f	消火器の技術上の規格を定める省令の一部を改正する省令（平成二十二年総務省令第百十一号）の施行に伴う消防法施行令第三十条第二項及び危険物の規制に関する政令第二十二条第二項の技術上の基準に関する特例を定める省令
ae34df45da86d73f54ba239a9006ad756898f77dcd2d3820ff5e924e07058e1d	消火器用消火薬剤の技術上の規格を定める省令
8ff0b1e7df040a552192e272644c42337fb473ea5fb504229a3b4d0ab01b2e4e	生涯学習の振興のための施策の推進体制等の整備に関する法律
ad2fa3c21d67e40473bf87b61b633390cbfc8d14f2229f616022c009e568a936	生涯学習の振興のための施策の推進体制等の整備に関する法律施行令
7f17ffca8903eb9d719d98586e61eeee088e95984c548b09d51109f0f9650435	障害支援区分に係る市町村審査会による審査及び判定の基準等に関する省令
5c5ebdcaf5fe92552a020d578c4da460e7e1a9e77dd0dc6268d6e9b8c336b61b	障害者基本法
c4f74a1dfc34cd5269794b8dea7814de6e9e8611549fc27e0012f1017cffd628	障害者虐待の防止、障害者の養護者に対する支援等に関する法律
0f7014d3594888b2aed6f41e10152c7b080c7384f806ea4551c1f1432dd3fcb9	障害者虐待の防止、障害者の養護者に対する支援等に関する法律施行規則
9d1c9c3610fec9ccc80f5884f1146e75c417a31d333cddcdab5b395fd089601e	障害者虐待の防止、障害者の養護者に対する支援等に関する法律施行令
4c28d42a9698bb1ce7797025755a15ba282adba111b933bd7f89fdfdaf9775e4	障害者自立支援法の一部の施行に伴う関係政令の整備に関する政令　抄
324b4972d17fbb2aa0a0ac1da5c78c8cabd963a24e98a59209329fe8e299ca46	障害者自立支援法の一部の施行に伴う厚生労働省関係省令の整備等に関する省令　抄
b7f0bc8665507b9928ebb45a22aa4d9e3ebbf5f40a4e1acfdeb4ae3886fd6482	障害者政策委員会令
d860ca71d7377acc3dc3675dc0370d216465f071ab012e7349a0bf676d956453	障がい者制度改革推進本部等における検討を踏まえて障害保健福祉施策を見直すまでの間において障害者等の地域生活を支援するための関係法律の整備に関する法律　抄
61bd5410b10c2420d740880639f80e83d5f5da9983ec9835b4bc7aa77535c623	障がい者制度改革推進本部等における検討を踏まえて障害保健福祉施策を見直すまでの間において障害者等の地域生活を支援するための関係法律の整備に関する法律の施行に伴う関係省令の整備等及び経過措置に関する省令　抄
21df17a5604ee5a3547faf2cb8d44b93f00222e4e953e7ad3e09d766ca45789b	障がい者制度改革推進本部等における検討を踏まえて障害保健福祉施策を見直すまでの間において障害者等の地域生活を支援するための関係法律の整備に関する法律の施行に伴う関係政令の整備等及び経過措置に関する政令　抄
0f548d78c3fe5acd41a639df383275f3d72292df8c015ce9b0b86a7c65fd58cd	障害者の雇用の促進等に関する法律
75b653fa60358b8e1445467dedd1b96b830b84e37656c0f7d04f2cba46e1f874	障害者の雇用の促進等に関する法律施行規則
9cc3bc93b5cf43d41bf4ac1dcc70ca1d189ddd7dd271c0095fb66546285dece9	障害者の雇用の促進等に関する法律施行令
81f4d2e5975baeaba85b816308c8719e208c7a341397ca0cf73586e6211e4190	障害者の日常生活及び社会生活を総合的に支援するための法律
c3783ec9a67b7b7711d5667eebc6d70441110eb4db0fbb0de026b15d59a3bfbc	障害者の日常生活及び社会生活を総合的に支援するための法律施行規則
dde6939da5252fa7818b112f3716957eb3591cfc776fdc279d81d000e7991711	障害者の日常生活及び社会生活を総合的に支援するための法律施行令
be36317f6b15ad7a43d7454c6f5a490d19cfe543bdd964e6d106960ea03349e1	障害者の日常生活及び社会生活を総合的に支援するための法律に基づく指定計画相談支援の事業の人員及び運営に関する基準
5853028a7f94e8739f90f2edf27bb53d3541a842b2e677fb80c65b0e05057e88	障害者の日常生活及び社会生活を総合的に支援するための法律に基づく指定障害者支援施設等の人員、設備及び運営に関する基準
0293fc7ae21afd61db09ac1cafb5736063b07b53c6b5b7ccc3e359771f370493	障害者の日常生活及び社会生活を総合的に支援するための法律に基づく指定障害福祉サービスの事業等の人員、設備及び運営に関する基準
85f49b3d6ae4ae5db9baa96c7f8357d40034807fb009eff28df6b8267166f60e	障害者の日常生活及び社会生活を総合的に支援するための法律に基づく指定地域相談支援の事業の人員及び運営に関する基準
c7dbbb306a62a239ce12d1150c550ddf75206cdbc1bbeb38a1f06998602b774c	障害者の日常生活及び社会生活を総合的に支援するための法律に基づく障害者支援施設の設備及び運営に関する基準
53c53f3694a6bda86e98e95d4b00e1a7c47da272d1f7015dd01fd5d2c3c02666	障害者の日常生活及び社会生活を総合的に支援するための法律に基づく障害福祉サービス事業の設備及び運営に関する基準
bb2a05fea0b63f4c5ad1d74ce1a78994e1fa06e880247bf29e0c5d159ed8fbc5	障害者の日常生活及び社会生活を総合的に支援するための法律に基づく地域活動支援センターの設備及び運営に関する基準
ef0f486dc21eba6e48c68456b00ccc7ccc9eb3193f2fb251288c75a4c368b57b	障害者の日常生活及び社会生活を総合的に支援するための法律に基づく福祉ホームの設備及び運営に関する基準
eb1554ecaedb6023cd981b22fe0e3e4c1970a5197e4204ce0d3862b547639474	障害児通所給付費等の請求に関する省令
8fe8edd21c95682195056d79fa6357d9d97d7f2917be851bef357cfac56fa69c	障害児福祉手当及び特別障害者手当の支給に関する省令
4b3c9d5bfd05dbeb177adb65d9d104df39d6ce554e2d8bab52ded52ba11d32b4	障害のある児童及び生徒のための教科用特定図書等の普及の促進等に関する法律
146a6fb33afa78b55bea54f05568586d3025ba937889207501c516e605950ba3	障害のある児童及び生徒のための教科用特定図書等の普及の促進等に関する法律施行規則
b86a3eea689f82446d54f03d22751233d795bbf05d385880ea0ad71c8033e00c	障害のある児童及び生徒のための教科用特定図書等の普及の促進等に関する法律施行令
56625f7be7dd8ed48d363d0dd22c729f14b1eb8459f974fc0b54c00d9a225d2e	少額短期保険業者供託金規則
f9361098ccfc0f3434723cdbee26aa306b1d16b25c892fa150de463dd910f8d2	小学校及び中学校の教諭の普通免許状授与に係る教育職員免許法の特例等に関する法律
5b025f6552b0b1ad6b29e3e31b309d143ae7a290c46b1d5af855cee99b86344d	小学校及び中学校の教諭の普通免許状授与に係る教育職員免許法の特例等に関する法律施行規則
9bd827c5ad2143db7c61996048f07d689ebc043e4b1c637672c648d328205f17	小学校設置基準
6a1dcfcfe5d4d403338aad16053643e8fa67afd8e7120852ee906464c9110075	小規模企業共済法
1e26bc3f716fa9c37993d778c44d922221a656a12b7f7c1934358aa714fa35bc	小規模企業共済法施行規則
ae580af210389c588a8a60be7cd45820c019d00180501512802e85038737e14d	小規模企業共済法施行令
58762aa5c106efcc11b276d1f79e21c685e959c4b6ecee8a1ccd786095c3dba6	小規模企業共済法の一部を改正する法律の施行に伴う経過措置に関する省令
0b07413bbf6ecb9204a410f0cde51d672261fd0b413f8ac58d572d8397605ea0	小規模企業共済法の一部を改正する法律の施行に伴う経過措置に関する政令
c47db42f99815345e3f10e89cc4f47d5239b45bb3e16f2f1b0da7faed1d88563	小規模企業振興基本法
914508d1276aa346e9103c4ae5640fa7cf88e1257e26e711218d5151620b7357	小規模企業の事業活動の活性化のための中小企業基本法等の一部を改正する等の法律の一部の施行に伴う関係政令の整理及び経過措置に関する政令　抄
ff0f4cabdf55ff4b6af597db279d2a3df61c889d945e53421d919b0ff4e133ad	商業登記規則
cddfb17377c3a615590fd716695a116afc2e298d02f0dd0db8f3e151e62928d2	商業登記法
287a936da44fe5df42b356fcb5438be64dfdc3304b1d335cc3ddd0d57a754eda	商業登記法の施行に伴う関係法令の整理等に関する法律　抄
bd69ba562cb898a400a60107e54a07e797b9040596d00c8cbf6fe92ff9205a9d	商業統計調査規則
6031cad03b037b5b5032fb22a150df15d435566dfd76ff79ce37e2c5561c78c4	商業動態統計調査規則
c1a88bbac929e66bdda2b2730fb04a7e9cbaa1847210f70019e5770ff281e6a2	承継銀行等が取得した不動産に関する権利の移転登記の登録免許税の免税を受けるための手続に関する省令
c1a88bbac929e66bdda2b2730fb04a7e9cbaa1847210f70019e5770ff281e6a2	承継銀行等が取得した不動産に関する権利の移転登記の登録免許税の免税を受けるための手続に関する省令
63b99340579c6ea35e992b21c2e53eca1abbd87e296d8343a8e50130fd5e56ca	証券金融会社に関する内閣府令
5d441ce611fbfb1e8c609e079967db009c6a2e3249708e21de7444bd68562072	証券情報等の提供又は公表に関する内閣府令
945cde7c38e63564b719f6264909744814431e18f68eebe7aab3570e2c0d0d45	証券取引等監視委員会の職員が検査及び犯則事件の調査をするときに携帯すべき証票等の様式を定める内閣府令
abc9c9181d462f55c0de7d872f20bfa3e36300123616015c619979a508b50f97	証券取引法及び金融先物取引法の一部を改正する法律の一部の施行に伴う経過措置に関する政令
258e9174ca417770ae929551d35d23bcd5f46a70ed32a0c78e8365cf20a2985b	証券取引法等の一部を改正する法律及び証券取引法等の一部を改正する法律の施行に伴う関係法律の整備等に関する法律の施行に伴う関係政令の整備等に関する政令　抄
613939a4143a22379711590c9e94581234852e0bef463582d2b93c9e1479ac72	証券取引法等の一部を改正する法律の施行に伴う関係法律の整備等に関する法律　抄
8253ac356fbf87020d428c971fd6deb037a77254186b1cf88c2075dd993b2290	証券取引法の一部を改正する法律の施行に伴う経過措置に関する政令
67a9fc6d93a452dd62218ecc721c9e1fb9bb88ceb78290035ab1b6eb1e4e7113	商工会及び商工会議所による小規模事業者の支援に関する法律
0855a401b576e951928135a9b8ed0d2b3bdec19ff4d7105d700aeef736c343d2	商工会及び商工会議所による小規模事業者の支援に関する法律施行規則
784dd1f7bca21428f60ad179977efbe59db0dc479c4848c8a0c33b3dceea6042	商工会及び商工会議所による小規模事業者の支援に関する法律施行令
86d4b2c6f1ebdfc184a7ce17126eda86fd253d2fe8ec388f02bd55cf47ebcea6	商工会及び商工会議所による小規模事業者の支援に関する法律に基づき全国商工会連合会及び日本商工会議所が行う債務の保証に係る財務及び会計に関する省令
fa5c3f57c613ed3e42360a60dcd22ad08b3e26d515e3681dc15d6db0e8a65c53	商工会議所法
89c1c42f8b7c0d2d335fa5f78881440233cfcfd41685ab2952f39e125ed70125	商工会議所法施行規則
bd569f713569e86dc2b2d850f2da8e611412d58a06dd5b36abef71968abaa05b	商工会議所法施行令
a82ce4454b135abc4a1070e5f08d7a77755de54f9ebb58ddafbc3d5f1e581909	商工会法
4a1a7d2aaaa2d2e57db6322ebb130e2fec206a45bb00e2e8c8381b7b5f2ba5bd	商工会法施行規則
f5b976074ca17c3f5d0d5240680191e1dfd67e57f7e698570196198e44691d38	商工会法第六十条の規定により都道府県が処理する事務に関する政令
7a510fb0e49c69a78383b0a8b95039ab594863092c7e587052b909e036408acd	商工組合中央金庫が株式会社商工組合中央金庫となるための手続等に関する政令
152060b70f68f93915daf926a0b8d2c6529f6851b42ba799166a7bff467a3380	商工組合中央金庫が株式会社商工組合中央金庫となるための手続に関する省令
131d78a4a1d26664274c5658883134868ab4620bd4482759af578df045d6ec17	商工組合中央金庫法施行規則等を廃止する省令
ba43c34839426a7c484d5b5b291b475ddc8f3cea8f088a1e2c3abcd53d2e5b9d	少子化社会対策会議令
c909331441b00b175c4c2553b312c9f4db450fde4e9c2db61affa757fbbf0756	少子化社会対策基本法
e0388e837922202922a7a1cd347c1bdf38372efae66288b8ff62237263578560	消除予定添加物名簿に関する省令
c31cb744d9871e3102f153779d2cabfcf74b51e2165dddc75dfcf4edbefbbfd1	商店街振興組合法
b83fcd11e4b3aa4e14232ca4ec38a0526218c220df143c874f0c9adbb2732ab2	商店街振興組合法施行規則
5b10ed7a5980fddec0a6e4653f88ecd7242600760a9d6bc0c5b194d659eb3ba6	商店街振興組合法施行令
4158c82ec306cec176e373fd96c31df210bedba4693881eff3618e2b3002da50	商店街の活性化のための地域住民の需要に応じた事業活動の促進に関する法律
ab863e2d7fd67c977ba84db9bbcd1e3e48bc3f047049299f6bdb0bcc149bb471	商店街の活性化のための地域住民の需要に応じた事業活動の促進に関する法律施行規則
e8b90804984b4422b0ab27570c18a842ffd1f0e974c5015473485ac78fa49036	商店街の活性化のための地域住民の需要に応じた事業活動の促進に関する法律施行令
4b629e8632f37cfd439e50af15f00120a7c267026a1b8f259b2f5f2522754a89	証人等の被害についての給付に関する法律
4ea7eaf1c0999cfd67ce8af731eae1b6dc8eff8368dedd9ff3f63d7eb3b27798	証人等の被害についての給付に関する法律施行規則
522f7bab729b10eef9335f3a1b83901283aec04e2ee2da2d30150ce4977cb3b8	証人等の被害についての給付に関する法律施行令
995af70e9ca31656c0b104e3f1ec402ed9a22366e4aaaf5cbf82490189fbfb5d	少年院及び少年鑑別所組織規則
f4922eb1a65ee17e2f7052db17b638a230b6bd4846fae8e54c17853268faca85	少年院法
5630ba5145cc2f4529d6100f97a0764ac5b62a2d206769b968e23d1790ebb1e0	少年院法及び少年鑑別所法の施行に伴う関係法律の整備等に関する法律　抄
060f6e64fbc6c2b3d1b8db1e73150c4b127522813a191dd556657cf7953bd6f9	少年院法施行規則
5912971b18b155417d6306b6e5885e461fd611cc88d6def9bcb4ca9283a053d9	少年院法施行令
9118a87f5c5f208be84a579c5d4d3a56371a427d1792e46a0132746334080668	少年鑑別所法
ace63da3b10e6d4e8538bc05dccae20377fdc8988d97bc46172100974c5c07c3	少年鑑別所法施行規則
8bcfc116644209a628ed3a56afd1eeb1aa3a2ed48391d226e64d9345ef309c76	少年鑑別所法施行令
3bcfc3f5e453d05653160167005b4ec529649dcf07fa9089ebef856aad40c590	少年警察活動規則
8eb8630d3dda6734751f38045e4dcd503c02077a8249cb4579be8979de6bcb66	少年指導委員規則
c05dc5c27a1a10ef9eeb3bfa7c2dfff45e8e68b57e1fcdb33b02d63d7bf718f9	少年の保護事件に係る補償に関する法律
391d6fda82fc5532ff4667fccacbeabd5f12061aab34c4fd905626a1d5fef7ba	少年法
51423b9a3bd1225ae9fa9a886dda87fca7b925607fb09c6746108c54734b2943	少年法第六条の二第三項の規定に基づく警察職員の職務等に関する規則
da52bcb415a1e16d2749bf6039b8194451f2ebeebca5e91bf6fc07057b4a0647	消費経済審議会令
53e4c23b7157e2fded94a30d281fc5ce25ce9478bba9331e9ff3478efade1dcf	消費者安全調査委員会令
b4a3b04a5155c6fd431098bb2b32df9469698cb48d72feaaa555d019346066fc	消費者安全法
1b64bcd107b9e719b0ba3a06bb96456761fae4db4535f657e91102b18ddd8bea	消費者安全法施行規則
fdf3eedb6e84989df79893c0afb53571354941715e9aeccfb676e418ac2cf7ff	消費者安全法施行令
4a9b8ca69c593d960dc8ca05394a4f833587ef5a03a641ee7c2f64bad14ba766	消費者安全法の規定に基づく立入調査等をする職員の携帯する身分を示す証明書の様式を定める内閣府令
b82c491bdc971da1c941f86d6cd7a4d6fcc49d18b9517b68fc990fec9d88b2a5	消費者委員会事務局組織規則
5e25574b15ccf98c1399a5e4125e09b5f792e4ee13e8aa2e8a4aca9634395e62	消費者委員会令
c0478e95e1916597891d743265645e95d600c75c984841a393d7ea6f47dae318	消費者教育推進会議令
2debbb0814a6072010d91a080b2420481322ba1b80b62c90a95d1016eea13e01	消費者教育の推進に関する法律
851431418955fc3a16dfe5bec8c320fa9ca87fa254d47182299819a915cfdf71	消費者契約法
566d317da4efb8d19b63f733ddc87843277b9b3e9f58a4b2fe0765218b46555d	消費者契約法施行規則
9d576bf9cc04d30b1cfca80602109e21fdb005224800c751bef0d5e7c6190c2d	消費者契約法施行令
1ccc240979babd52aeca8f343e62087c2b77dd07290fbb12423c68140daa7777	消費者政策会議令
29b7d8dda490a508fc407c3b77a6357f66ff8df8dc4c2b243c38e3edf0eef9ba	消費者庁及び消費者委員会設置法
412b2856bafa99fb7533284ad5a16c36477db65d14a2389a8cef0265bd3e4b00	消費者庁組織規則
7a8fec7de10d97f01df1a047e8f98b0b2702b9e5e202164f8f8122a40c1e2a34	消費者庁組織令
0c60dbbf3173eefbec3ea967db5c706e8fb045941d13db31a8b356f748a4ac24	消費者基本法
38d2df41cb35ef09710ed768dd4b86867b1070d32f20066c62c4fd5d55b4e551	消費生活協同組合法
6ad869114c19654604222089d672da92a0a89f82566fc6f4f5562e10860b5b08	消費生活協同組合法施行規則
e1343d9844ba2772fee84a7478097ee7c550164029863153edd43a149c3c73d8	消費生活協同組合法施行令
f55273c6ec37a46daf83a7fb502aa0ef5bca5b874ce1a7c9294887784a9fe419	消費生活協同組合法の一部を改正する等の法律の施行に伴う経過措置に関する政令
7e09a33ef7f55fe44487c1c342a08ad6a17a02cd4a75d016f4b95da256ce3d2c	消費生活用製品安全法
e3052a1222586e97cefa46e908ff1354887786f85e63a18c8313b4eb97c36ba5	消費生活用製品安全法施行規則
7588812cb55c25fbb326de98350f5032f380393d77cb685c950a66b249cccc90	消費生活用製品安全法施行令
6a583514b81855f885910b8d00ab7cef3c6e77464fe456e224cb2e5ec1fd9470	消費生活用製品安全法施行令第十四条第二項の規定に基づく都道府県知事又は市長の報告に関する省令
8369cb2b91fc9c77857db66da485c8a023e1b988088f4e0be9b7f309f32caac6	消費生活用製品安全法の規定に基づく重大事故報告等に関する内閣府令
c58a0c7acde191c4b3986280737797457b21537ad7f1efac97f597661f2a1917	消費税の円滑かつ適正な転嫁の確保のための消費税の転嫁を阻害する行為の是正等に関する特別措置法
508ba498cb742927682d196ba0a3d1f18e096db0c28f4ce5832d5b220e8cb8e9	消費税の円滑かつ適正な転嫁の確保のための消費税の転嫁を阻害する行為の是正等に関する特別措置法施行令
5097ced469d1722a7621aabf13022b1a28fcaeee6cfecf8e40e66a90886d4249	消費税の円滑かつ適正な転嫁の確保のための消費税の転嫁を阻害する行為の是正等に関する特別措置法第十五条第一項及び第二項の規定による立入検査をする金融庁等の職員の携帯する身分を示す証明書の様式を定める内閣府令
38d77d54e882b7aaee5d60ff309a071cdbb5051b46354e9d53514a0e49200318	消費税の円滑かつ適正な転嫁の確保のための消費税の転嫁を阻害する行為の是正等に関する特別措置法第十五条第一項又は第二項の規定による立入検査をする農林水産省の職員の携帯する身分を示す証明書の様式を定める省令
503b2d7dd81edf966d8b03c83b0157d38764ec0073d2ac6f4b48a1199bea6664	消費税の円滑かつ適正な転嫁の確保のための消費税の転嫁を阻害する行為の是正等に関する特別措置法第二条第一項第一号の大規模小売事業者を定める規則
f012fe1b7c9e6fbf0aca9c1070ab1d101e90f96c156fcb6e3bc5034682600dde	消費税の円滑かつ適正な転嫁の確保のための消費税の転嫁を阻害する行為の是正等に関する特別措置法第八条第三号の規定による消費税に関連して取引の相手方に経済上の利益を提供する旨の表示に関する内閣府令
66e4de3ee8b7ca43d0bafc55fcb3e7cc08ac2f99cb72fc100a24191e85a06f9a	消費税の転嫁の方法及び消費税についての表示の方法の決定に係る共同行為の届出に関する規則
0c268fc764fb8c84a2f5212354b58e846147f0f6b6e7eb2c072de1d97a696a91	消費税法
47fc8c6bce569bb44c3813021f95fdcd92a417e80a1ad0033a362d47f8815261	消費税法施行規則
0aee711b858464c4c8194a12f734c3f6ffc4944aca48664ddb9d403ba931c0f2	消費税法施行令
1453179ffcc8d1298f5b6ec4a3c4ed95a7b0d34cc7187141a8eeff066bef098b	商標登録令
a2b727f6357b2cc34763bad1df3733331fe7abf168a020ccf9798b6894347925	商標登録令施行規則
3c5ec3383b2b59a09896e69932db7b982a71e9f6f37d22b2c0ed833921ca7a69	商標法
9f72ca697345246f06e4ec3a4f382e39ce48cad5dd061d3c3e3a2786875a5a6e	商標法施行規則
788060eb8f1601e23c687033ebb746953f97ef52431488852ba4bb3ee009efbe	商標法施行法
7061dff8dae46d7f029b6b8916fe86c1e6a41b2364908dabe968a31b1a3816d9	商標法施行令
fdc1174caf5101efd2a6b9482984d776b690948e66557f6dda3b9163017ee23c	商標法の一部を改正する法律の施行に伴う経過措置を定める政令
869702b14812db2e8805f64c3ca737072eda60e09b53aba9bdd32b15123cc3c0	商標法の一部を改正する法律の施行に伴う商標法施行令の規定の整理及び経過措置に関する政令　抄
096f89068442f48dd6a7160912beee88dbc12e371e7d3feb716e45fcb6512a73	商品先物取引法
ea5f4b1e98254812cd2beca9fee35ee8a4035233b1b7a20e12d9d70913ea90f2	商品先物取引法施行令
3a5ee9dc6177c65b47e040075f5ade8ee9f6d17dbc00946872a754495db229e6	商品先物取引法に係る民間事業者等が行う書面の保存等における情報通信の技術の利用に関する法律施行規則
5571431836aa21e43abdac7620a5433c712358124c04c5b5b643fb628ee46a2d	商品先物取引法に基づく不利益処分に係る聴聞手続規則
ad1dce4409e6953cb1af6d7e0b188173f66968dc103874919b62df4b016bcb3c	商品投資契約に基づいて出資された財産の分別管理に関する命令
4881a8e59dfffaf8ffa8b3ba4b3ab1ab6cf3b00fbbbda5f47038d05eec681128	商品投資顧問業者の許可及び監督に関する省令
2c3e73334a9cee097b6b2cc2bd886de45266b5b8bb3615d4e8c652bd9b47aaea	商品投資顧問業者の業務に関する省令
60fba8067d802b79c419bddf8d3c6916c99da93e78858bd1a731d356b29c186d	商品投資に係る事業の規制に関する法律
b8873070b7e62036f56aac973239eb6342124b86d6218493dc7090e8a70719c0	商品投資に係る事業の規制に関する法律施行令
108a05ebcbf0cefc2bc518c6bac99c7ce45c6aabb5b9fd4d1ea9d8ed046db763	商品投資に係る事業の規制に関する法律第三十七条において準用する同法第三十条第一項の規定による立入検査をする職員の携帯する身分を示す証明書の様式を定める命令
e434a819ef501dcb7b533722a2643ee1716f565464ac305b8b76c73bc65e5863	商品投資販売業者の許可及び監督に関する命令を廃止する命令
58ad132dc46bf0c8038c92816c06ab713d674c80d083704b49d5929ca4ff11e4	商品取引所法及び商品投資に係る事業の規制に関する法律の一部を改正する法律の施行に伴う関係政令の整備等及び経過措置に関する政令
6d0ec6b766daca485cc815cb1759b46141f1bb79f83608f4445adad436c3e0d7	商品取引所法及び商品投資に係る事業の規制に関する法律の一部を改正する法律の施行に伴う農林水産省・経済産業省関係省令の整備及び経過措置に関する省令　抄
a09f6b747384f791d3d0786ad27c56ed87352aac3a174de080e8bf8faa40d698	商品先物取引法施行規則
