1ee9febb1839ed4b4a422799f2a609822576a4b21931227e6efab34c2bf3ba93	復旧の目的としないこととした農地及び農業用施設について支払うべき金額の算定基準を定める省令を廃止する省令
c775af4723d1ac7537c2c714226989d14d7bced9c1333af28783caf308127dc2	復興推進委員会令
666f98e3f808048d7d93414db690c88af23e24d85d51818446a3110868565334	復興推進会議令
93fc4636b041dd5177086a7b6627ce5f8730a65a4256fd4d5db23e65018721a2	復興庁所管に属する物品の無償貸付及び譲与に関する復興庁令
a618592d515a9c208afd220a44467c5988aa781b976bd5c084e60215eae051eb	復興庁設置法
57cf6605ea6f6192ccecc4174162123c0a06a239d2b9fc6d1d274c10cbbee5e4	復興庁設置法第四条第二項第三号イ及びロの事業を定める政令
1ba5568ec27ab493f16c4e3ace1838f02f63bd90c6144ac82395d9d4ff43916c	人事院規則一―五七（復興庁設置法の施行に伴う関係人事院規則の適用の特例等に関する人事院規則）　抄 
6d9fa9a388cabb2a42edcd2f75f3b81ade194e605426687890edb80b422bd219	復興庁組織規則
7374b7110d501b7a15f9f3918352ef82cb17b563986daad080fe4bbcf597f80c	復興庁組織令
dc054daefafcddf465b40ff0601fc2704e803a35f6c0d868ba8fec7547cfef04	復興特別所得税に関する省令
a0165fc07c7d86da53f01fdbebcf4dc18e902d41aeff5766c353e9575e912fa4	復興特別所得税に関する政令
bcb022db32ae4ef151db4404e8c3fc76a747950ec1e18f4658a995351f69f114	復興特別法人税に関する省令
bed705dbfe3e7e561b5ba913a5e953efe9765339fd7aefe4e7b735d92d843e6e	復興特別法人税に関する政令
6c477f1bd6d91822baee25c228eb6f9128ad307dd6252c3740bf654fa90d22fc	普通交付税に関する省令
8e4f26a4ee5f17e14538239b4df83cada5412b8c3da7f2f77f26310d8af721fd	不当景品類及び不当表示防止法
9bbb2245e0384ceea618450d26075c02d2bb730f9a0ea0fde36258271bf550ee	不当景品類及び不当表示防止法第九条第一項の規定による立入検査をする職員の携帯する身分を示す証明書の様式を定める内閣府令
3479c0ed07bc42bda94402009517999c114f8a4e5bbf74fe2c27903c9e836ed0	不当景品類及び不当表示防止法第五条第一項の規定による公聴会に関する内閣府令
95af8ccb74421af45e657274b98beca50d3f51af34d9311bfa35ef85e8a83142	不当景品類及び不当表示防止法第十一条の規定による協定又は規約の認定の申請等に関する内閣府令
1d712f1bf1195894121143267dcebbb1a4ef53b40b8d7d774d9923ac5ed1c97f	不当景品類及び不当表示防止法第十二条の規定による権限の委任等に関する政令
ff5084d6267e132d33d7ebdc62a8e96c27b84bfece73ea424dcbec4ee373da54	不当景品類及び不当表示防止法第四条第二項の規定による資料の提出要求の手続に関する内閣府令
a072a945476dcb1f77dea8b8ffe36dc7f2d2f2e507f9b5e1b5631f602706ba8f	不当景品類及び不当表示防止法等の一部を改正する等の法律
c9e2176495fdd76c9e36d88830df2510786a4ddc781be9b1572891073396c05a	不当廉売関税に関する政令
7ed76102e2c5cd25b10ca0db6f19eba6c1f73930c0f932860540cf2c67129547	不動産鑑定士特例試験及び不動産鑑定士補特例試験に関する法律　抄
9a4398071ac1645bc21c994b00f95fd23f7d23bf449246e0d97220effc6c6f39	不動産登記規則
9f45014c485fb3e4bf008c1f3775b7ab3f74391319726d4c877c57e5208c3fe2	不動産登記嘱託職員を指定する府令
7434d431af828d70057cea13bcc38eccaa65ca98531397391e1bcc74b128f7d8	不動産登記の嘱託職員を指定する省令
0bdd7e3144d1be99f867fe14e754f1091fd9e7f2b19248b2ddfff41046759373	不動産登記法
3d07f668c01bd2d6151965f4aa4d56502e865c6f3d330ca99580b95ba5a430fd	不動産登記法及び不動産登記法の施行に伴う関係法律の整備等に関する法律の施行に伴う関係政令の整備等に関する政令　抄
5773caabd8ed9d846e0f8ce5445a3d3e972197703aa246224ef5304bc16fda09	不動産登記法及び不動産登記法の施行に伴う関係法律の整備等に関する法律の施行に伴う法務省関係省令の整備等に関する省令　抄
8e487b3d76a98be6fc0a3e24e5b43a8b486edb487fce818ebe1c8db055774d34	不動産登記法等の一部を改正する法律の施行に伴う関係省令の整備に関する省令　抄
a0ed02e5bc5dbf9cd8d0fd7fe978dec2e0463f8c59c1750e502cbae717b27045	不動産登記法の施行に伴う関係法律の整備等に関する法律　抄
011d3d04854c40e697e9219ba81af4154fbd7abadcd65aac47536209e7c520d2	不動産登記令
b7df67083e9c985d5969c510fd8fc7dbc7ffcfed36deacbc1a531469da1d3fea	不動産登記令第四条の特例等を定める省令
3dbb37196cb06c9b6b7af25c82313dbd0ced60517950c2600435a201e80ed2dd	不動産特定共同事業法
475aca42bd3110a241b742f028aea51ae963b4768d60501237e87f7ca24980c4	不動産特定共同事業法施行規則
49313ff20140fbb23e228d055710718b184d184ac87e2b257e899bf25d20d715	不動産特定共同事業法施行令
43a44404ded4c29b16a795cfe13a51e3dea75cfd9a2b74054c6c6ea932e11b93	不動産の管轄登記所等の指定に関する省令
851828eeeb9ebd4fb460ab8bb121e210228f6bfb4818c3a41f13faa846f65963	不動産の鑑定評価に関する法律
7f4f9bdeeafb3897d2f321aaa89f6e23f1ea78ac104fa996124c05302802174a	不動産の鑑定評価に関する法律施行規則
dba647a9639479071145f78b046fcabe21d02c39bdcc7fbb7e4a4d97504bba78	不動産の鑑定評価に関する法律施行令
77fbf07d1732d43fa319ea393b40b3f2a2b1480e1a303a961389b7eafd5ea6e3	船用品検査試験規則
e60d80d61aa53521315fc6c0f4670936ed783cde9c34f4f2b2b714dc63200ebb	船用品試験機試験規程
bd60dfa3c3413f7399bc73444aa17460fbc29d6812cc22c0a8d74b89a1bb00fa	踏切道改良促進法
639211fda3e6d5f99c3afab3812f9d9ad3715fb43ca1ba1dbb00ff960f3957d3	踏切道改良促進法施行規則
a09a32f7e94b1f3f78a79742dbac6f61a2bf7d794c86f4f91e66b6090ab52e15	踏切道改良促進法施行令
c3397ca6a301ecc6b2cd4e4470f3e313e5cb1e4c22bf24fed773fb1bf246d406	扶養義務の準拠法に関する法律
33ddc000f2bc861cd7068a2807fdba1a3d6b3210d8dd0676fbcf55bb680de151	不要存置林野の売払いについての国有林野の管理経営に関する法律施行規則及び国有林野の活用に関する法律施行規則の臨時特例に関する省令
a2a6a721bf9164b8994686730e4fc0b1ed2b1f07cfa6be6f4a1ce9f580b78f4f	人事院規則九―八〇（扶養手当）
8d5cd0f6fcc7d801c237043fa91d43ebaa6fc596c32b09523caee5415ffce705	人事院規則一三―一（不利益処分についての不服申立て）
697539f388af90f4876bbb022df5843a33304ccc92940ce625ad050e0a244759	振替株式等により物納の許可をされた場合の収納手続書類の記載事項に関する省令 
70f729c6734cf51adc4935cc29245adf1b650895cb2116f9027d9214407f2c91	振替国債を取り扱う振替機関への同意等に関する省令
b3b99135b3d3732101a182226c3ca28150f2aee6b5675cf0b16951c4618ca485	フロン類算定漏えい量等の報告等に関する命令
884afc1039d0866c6eb99adf21f0f281c42b61eb34de560778688fb8fe282f51	フロン類の使用の合理化及び管理の適正化に関する法律
c74073294342518462048d492167ef1ff0847f05018c2241b848193b80791f39	フロン類の使用の合理化及び管理の適正化に関する法律施行規則
bf419b5fb5d752f2125fd6d836514f74aa14e5d81b52c3a5b06c926cd07c8e4b	フロン類の使用の合理化及び管理の適正化に関する法律施行令
18598f1a8432342cc7fd002dbd13384b81d74dfd0bac7169699338b4a4b08cf2	フロン類の使用の合理化及び管理の適正化に関する法律に係る民間事業者等が行う書面の保存等における情報通信の技術の利用に関する法律施行規則
a696e34d559e72ffae1b95b7a9889f911ea100ca0165412f8d055bf8c6b46811	粉じん障害防止規則
1182325c20a90267684a2cfa68f2137fcbfd493dae81cfd16be9daecfd33d1a2	粉乳等に対して課する輸入数量が輸入基準数量を超えた場合の特別緊急関税に関する規定の平成二十六年度における適用の停止を定める政令
b521dcfd3eadef46c0211a84a9eca68459eccaee5c47712084dbf8ce4936f51f	武器等製造法
51b017eb8a92d9685a8c3dd25f2e038833aae106f1ef0dbba1deb4b124b6b348	武器等製造法施行規則
8e4d94bd8e940cfc88fcf92f50c2dd39a278b4a9e787afa42bd9c54531df8d3c	武器等製造法施行令
c9c4e4535a84605d880bfa389d86529950cfb753a2bda53d7fb4cf51f420868c	物価統制令
16aa1e88609d953cac15e0839027a942db84d8a24d2785a44b0cc14b5f99791e	物価統制令施行令
2d2f2115552575a78dc9b5d5706b73dd31f2d71effaa8b2e9cc418640a044f52	物価連動国債の取扱いに関する省令
aa50a3e84572c67bb32dc48d4a7e78741f59a8b090b43690eae48bd4e9078b87	物品管理法
db92f98a84c896461499f6cda71700b49058825174c264a5d0ae3d76a620e1fe	物品管理法施行規則
c5c32150ec878ae210b04775e78201266400ed5401a1e1ce37e105b997cefcda	物品管理法施行令
7a632081739e92976fa2157491d6cc5964978df59cc373908d8e6940eb552afb	物品の一時輸入のための通関手帳に関する通関条約（ＡＴＡ条約）の実施に伴う関税法等の特例に関する法律
82d6073eff786b99e7fe5d0464ffdfefd01a9d54eebade1bdd1b350b2c0524ce	物品の一時輸入のための通関手帳に関する通関条約（ＡＴＡ条約）の実施に伴う関税法等の特例に関する法律施行規則
7a32ef5a165a00ce1fbc4b8fe9a3ed3bf778309166666787e91f6a983cf217c3	物品の一時輸入のための通関手帳に関する通関条約（ＡＴＡ条約）の実施に伴う関税法等の特例に関する法律施行令
773f89d894087fff70cda21fd9b5207698902ac65f953e865add5dc74c4c822f	武力攻撃事態等におけるアメリカ合衆国の軍隊の行動に伴い我が国が実施する措置に関する法律
ebd044dbfec8b1f8022a510e65f741f5fe06ca1371051fa84ab8c60cf421dca0	武力攻撃事態等におけるアメリカ合衆国の軍隊の行動に伴い我が国が実施する措置に関する法律施行規則
2d520c278833b61a2b758b8f2db7a56078f4788fd93d939df200fe34ec74f21a	武力攻撃事態等におけるアメリカ合衆国の軍隊の行動に伴い我が国が実施する措置に関する法律施行令
d2889e2dd0d09c0449e77d06e73c6adcf64cb326d2b36f40bc801c2bed2d0499	武力攻撃事態等における安否情報の収集及び報告の方法並びに安否情報の照会及び回答の手続その他の必要な事項を定める省令
1d46c6e97ba7f41ef53c8d72b407ecbe52a60286a67885c23b3c4b64a8f1a556	武力攻撃事態等における国民の保護のための措置に関する法律　抄
b0a2482ca71e6867f8c2ab67157189e43acad98595d643d732db2447fead68a1	武力攻撃事態等における国民の保護のための措置に関する法律施行令
d5f7fdd2f5e2c27c15f3d66569d6704ddcedbc33a56222d26caceeb36f26afbf	武力攻撃事態等における国民の保護のための措置に関する法律施行令第七条の国土交通省令で定める管区海上保安本部の事務所を定める省令
b568e6df13d3d361f96537cf50e20054ecde7a75e678b1ecb2a94a2a6359f512	武力攻撃事態等における国民の保護のための措置に関する法律第九十一条第一項の規定による許可を受けようとする外国医療関係者が厚生労働大臣に提出しなければならない書面等を定める省令
2f0c00121c81bc1a4ae8bbcc33caf891c53d0a218b9de0c2fb24d2245e6f6dd4	武力攻撃事態等における国民の保護のための措置に関する法律の規定による処分に係る公用令書等の様式を定める内閣府令
a06ca62cbd2a3d708eee7a9dda227e6e7e6622b52c1d41a5d4314f0796a8638b	武力攻撃事態等における特定公共施設等の利用に関する法律
12d9cad59efe4a0ac7ca96d839a139ece017c7f9f17688254cdf42fc9f046a3e	武力攻撃事態等における特定公共施設等の利用に関する法律施行令
464c715f3a5726cd5930ddb182197e6b45c8e72d57910cc59724e0bde0ea9a2c	武力攻撃事態等における我が国の平和と独立並びに国及び国民の安全の確保に関する法律
88429ae18385f6ca4247cac9628e1827c87db35ebd55b7db181a233c730a6759	武力攻撃事態等における我が国の平和と独立並びに国及び国民の安全の確保に関する法律施行令
f743c0a3aafb02795c109fa22783f41deea2c87f655763ee53aa61ce48651f3c	武力攻撃事態における外国軍用品等の海上輸送の規制に関する法律
5b9d3a4a395a984eeb41061f9184d18bf921028aa8b3318f7a448e97b73e1a2b	武力攻撃事態における外国軍用品等の海上輸送の規制に関する法律施行令
9381eae3c6337e2ce608d544a93cf8820ed1030233bff09eab839c34a9a9a4dd	武力攻撃事態における捕虜等の取扱いに関する法律
545a1569cee2ff14e206528e8a43d010a3b27fb72268e665c36cbd2315a1d304	武力攻撃事態における捕虜等の取扱いに関する法律施行規則
5ce05221abd50ed196f0794274e7d1479ac0d0168af3cfd6def30f1c719f60aa	武力攻撃事態における捕虜等の取扱いに関する法律施行令
0555657a656f817190ebfab7d61318421fb9385cd0022c405fb595e88ad6e3e0	武力紛争の際の文化財の保護に関する法律
3849a28113208123386c5c3ab2f31c22db5bd6b509b1fd61450dfadf073fcc32	武力紛争の際の文化財の保護に関する法律施行規則
4572ea9b447825bb9eaf574362c9c6a651f75370b59a6ba44db778f89ca3257b	文化勲章令
3325488bbed797c97e8a3bdfe5211f64cd1e11aa4594ea4b57b6825b8d1e530b	文化芸術振興基本法
4c61fdaa1ace6f5a46bd5b804f1b3511bf38b34c7926220aa7bd6a8a4a3e7b22	文化功労者年金法
88a6dd45ede57740530dec8530617adeed1039d1a2caa0235e962e46d94af7d6	文化功労者年金法施行規則
3859d10da5ef8b117f3b68020fc13f254cfc116528b6ca8205b92473fd64058a	文化功労者年金法施行令
b77729ac08a2ce75a5d24beb09b96b14d373bff064592a30773a7634cffb890d	文化財の不法な輸出入等の規制等に関する法律
d239425655178f4d1fc908b51efd0d2c18adf509cc1ab6a61bd2c6811c6d5db4	文化財の不法な輸出入等の規制等に関する法律施行規則
0295aaf9fd0b4b7cce966a6cb41ec1b8cea92a8918513b1af0ca949005be5fa0	文化財の不法な輸出入等の規制等に関する法律第三条第二項に規定する特定外国文化財を指定する省令
e4a4119d5e3af0f5a69fe7cae2909dcaa6c82415230d0a3a76a1c65e5c31c977	文化財の保護のための条例の制定等の場合の報告に関する規則
5eda8ba8a310318fb4785f5f05f07af19098bc0bb0a08e2d06c25ed86cc4e8d3	文化財保護法
bbf59977d5ebde252eb14edd827de8bb45b5e3a7f0c0c14719c30c8aa728d182	文化財保護法施行令
a2b72e10595b59cd8c265167c7428e6854508bb59193603896d5da708f62cf66	文化財保護法の規定による処分等に関する聴聞、意見の聴取及び不服申立規則
b6adcc0963c9c341d29e29819b1fe0b59fa427e7bf93751c3794176e28867014	文化審議会令
9d160bbece38f94d28d430e00ffb2fd0ad703ce2c948e7b662902348fd4df75d	分収林特別措置法
b330515216260a435baf9f850619ed508ac3c9de8f5563c0a2f4b7005e5f6bab	分収林特別措置法施行規則
cdb38836dbc1d84ac46afeb4c7e7394bb846e6d9940f809a13a421fc6757a449	分離適格振替国債の指定等に関する省令
3ce226f25b8272d47b4d257774b5b28f70a010bfda0c897e696b6643d037c28b	プラムポックスウイルスの緊急防除に関する省令
0568f7a6eeb226ddebca4cd047692f32b12108d3c81c99a5f0b49c9d9cc1ec5f	プログラムの著作物に係る登録の特例に関する法律
4dcfd6a8b867afbd05a149107f0fe9e66c4f51c0ded399d5c8dd28855228196d	プログラムの著作物に係る登録の特例に関する法律施行規則
aefe26847cb43e63f60351e600553a9eeb94e46dc869995ab4cb5e852cfff89a	プログラムの著作物に係る登録の特例に関する法律施行令
097d3f5485c9bccbf6bcc75262d65d3868909e3771fcc478ed4555763419bdad	無機化学工業製品製造業及び有機化学工業製品製造業に属する事業を行う者のスラッジの発生抑制等に関する判断の基準となるべき事項を定める省令
1ab6e1880755f6dd073cc1ec9ffacea2395b13be9c827db961f786b8d82a6e4e	無軌条電車運転規則
3bbf74002940b360d568c2a86a1400a558ef5ae4407c652faa402b11208e8835	無軌条電車建設規則
08c9793862cf99fe3dd2030d45d28efaa2fc4b995c982394df35ed7bf0180758	無限連鎖講の防止に関する法律
7a3f74ff0d0f3efb39648c79324effecc924a199c60afb36d32136d16daea137	無差別大量殺人行為を行った団体の規制に関する法律
fdf9807e398de69b5c896c9c13267c6ed3c5201fdba96bdc08544140634fa29c	無差別大量殺人行為を行った団体の規制に関する法律施行規則
8b179161845d6aac2d8decef42b72594e0026029e71d342f4ea9d10c1a972795	無差別大量殺人行為を行った団体の規制に関する法律施行令
992dd80b789905e572fd28076c1ba80512803b849160b4be74bbcc34d84673a0	無差別大量殺人行為を行った団体の規制に関する法律の規定に基づく規制措置の手続等に関する規則
fe01355505deb09e3af0257ca4e7da842552b4db68467a6f722497fdaa14f4cf	無差別大量殺人行為を行った団体の規制に関する法律の規定に基づく警察庁長官の意見の陳述等の実施に関する規則
6a62b1fe4fb908b55e9bd20607ed9975d831a55344bf77ebe64b20193c16261e	無尽会社ノ管理ニ関スル登記取扱手続
9837f9d37448cdbcd26fd3a14de6d035e938cc3b71a40123978fce3efe9b1555	無尽業法
444caae05fd4f30e856c0eb114114048d06a741e069f05517bc36983b0bfa790	無尽業法施行細則
2975302446c0e4018772c117c1d8b379131d0cec64c189a339f21ba497d4defb	無尽業法施行令
832b80fb0e6c7eff69826cd3d96d54425b576948bdcdd5c13f234baee2990da5	無線機器型式検定規則
29e761fd0b3d17bfc3513127b328daa1912ec8d510826011c83e5bbfa58842df	無線局（基幹放送局を除く。）の開設の根本的基準
1e635e31bf31dc31cad936d6877cbf067e0fff3581f1d1ec0df66318287b76cd	無線局運用規則
ebc44bc1cfbc3f6bc64fd2bb7bd336e0924ed68b19819e5155ecfc88d424a04e	無線局免許手続規則
a8745a95b64ac158cd55ff0ff6d05877852a9fdc3bcd46aae44f8ea538269c54	無線従事者規則
a03cec0871ffdd8b52c813aaa072a81be86edd491c93d295497c9ca6bfcdf786	無線設備規則
cf2eaf44dbe1011a3807399cb9a824b674a374e554c2691125219d7251f4e53a	ユース・ホステル整備費補助金交付規則
1100df7afd85064fadef7544073532edfda589aa046757dbb98b6d3f280bc49a	遺言の方式の準拠法に関する法律
5f9c79e74446e85df7392506d13582c119bea228437d14fdf1b11d71e7ecf031	有価証券取引税法及び取引所税法を廃止する法律
eb0feb2d0863184fc0c4f2127abea1f942acd0d1e94b65c685193facdb5242ce	有価証券に係る投資顧問業の規制等に関する法律施行規則等を廃止する内閣府令
4b7cd257bcf0dccb68d71b7c7f995ac5a4a67ca88baed234dc03a216cacbb1f3	有価証券の取引等の規制に関する内閣府令
310e5d01ed1cee30673f39e7df62b2da5626d280913952a8090d37171a669232	有価証券の取引等の規制に関する内閣府令の特例に関する内閣府令
310e5d01ed1cee30673f39e7df62b2da5626d280913952a8090d37171a669232	有価証券の取引等の規制に関する内閣府令の特例に関する内閣府令
310e5d01ed1cee30673f39e7df62b2da5626d280913952a8090d37171a669232	有価証券の取引等の規制に関する内閣府令の特例に関する内閣府令
ab0603f59ef17815c1005bd611453dbdecb2ddcb803d8b656970af32892678d8	有価証券発行学校法人の財務諸表の用語、様式及び作成方法に関する規則
63e128bc6a5add55c73f2abeaabd5d5148836170a4c225eb123633677d98c6a2	有害液体物質等の範囲から除かれる液体物質を定める省令
01b961ca50a2392bb082d934d1ab7a7c910d999ae0369c39c1b49b49ee27a1d7	有害液体物質の排出率等を定める省令
91637801e3a9584fe9274d866b890adbf36200826723f6e4a6805fd435fa5d07	有害性情報の報告に関する省令
03899b882b89ef7b02f5eb979320074797765f6bd2d4ffcf8bea36567d042f2e	有害物質を含有する家庭用品の規制に関する法律
aac5c5e2612bbb44f2eadc79cb79b932cf07c5c0eb7ddcb3b0d4a405a5198322	有害物質を含有する家庭用品の規制に関する法律施行規則
91fa756e2ba68d86f2a1b20646e9f4eb5376c4551ba17369b4a228e5e1bec4e0	有害物質を含有する家庭用品の規制に関する法律第二条第二項の物質を定める政令
46831b2eb4d6c49e0370f99a7230533a8edf340ac855cddc46e7cf0b4f88c7fd	有機農業の推進に関する法律
ca3a169389800215bcfb433c7842346ef88a021dac69c1b9f62338837831f9e1	有機溶剤中毒予防規則
260936b88c7e071276adb9dd2ca2dca28c46a672c3ab7e97a81935a0b996b1ac	遊技機の認定及び型式の検定等に関する規則
ff54524e26adcf8951e331a6a007dca7c6a9c9b0210c9c8435c48ef9cd9fb48f	遊漁船業の適正化に関する法律
3578d5786bbb612d5e376702d29959721746d8b734d9ed88ff8e4d4d0865d38e	遊漁船業の適正化に関する法律施行規則
efefcaef1477ad77a1899eec189b6974d71b85a30274d872d74f1d6018838e24	有限責任監査法人供託金規則
478e29788705bb7acd924d7ca92a6e463ce53fdfc9b57074e796bfc53be09e00	有限責任事業組合契約に関する法律
d95433c7c5bdd5fcefa80f15895597cf9a09824f986775a4ece2c204527919f5	有限責任事業組合契約に関する法律施行規則
d14dea9be331d3cda9ad9a5220582d4c3d7d9153f3ccf4ffb58e2e88538d47e5	有限責任事業組合契約に関する法律施行令
cfe2030af185c338a7a4279df5b1e60017672da70975017559ba8778bc5fea0e	郵政事業特別会計の歳入不足を補てんするための一般会計からする繰入金に関する法律
cfe2030af185c338a7a4279df5b1e60017672da70975017559ba8778bc5fea0e	郵政事業特別会計の歳入不足を補てんするための一般会計からする繰入金に関する法律
5a1ead8b8e0c68246eca9d77af89735c16458e1602c238f7414a1beb9a5dd26e	郵政事業特別会計の昭和二十四年度における歳入不足補てんのための一般会計からする繰入金に関する法律
b2c39795510f4154f3e489acf10998e26f67eef1e2876c6bed08228b4c986490	郵政民営化委員会令
06939fbd5da57e72bb0b646b44f8b9c5fc007580436d4639df2dcda199d3aaf3	郵政民営化に関する法人税及び相続税に係る課税の特例に関する省令
33ce6435665ca3014e9a9b572d8b85d4c6142377856ca0a7a041f6bfa292956c	郵政民営化法
97a6dcbcccb8d82c343249fe9318ebe33ec5d82093db006651a5bd7691a4d62d	郵政民営化法及び郵政民営化法等の施行に伴う関係法律の整備等に関する法律の規定に基づく立入検査をする総務省の職員の携帯する身分を示す証明書の様式を定める省令
71ca5b6a339aaf45da551a571c930fc89488298c58d40f19f06ac81bcee911e7	郵政民営化法施行令
1f20114fbdbbf7e3b8693f36436a62f65d41ed2e038c48d475ad4f60c4dd5ef3	郵政民営化法等の一部を改正する等の法律附則第十九条第一項第三号の総務省令で定める小包郵便物に相当するもの等を定める省令
39c6985e37310733b7b14204c79464b2a67a7a8bb75ca2dfba391080c2b990ac	郵政民営化法等の施行に伴う関係法律の整備等に関する法律　抄
21a41404198154a9664fd4a74ededdf3a7847c3bfc9911377f9bf548a28ce935	有線一般放送の品質に関する技術基準を定める省令
7b92d95a27d596bbabc16c2c1b7545f2042db0fa640fceb0565f5721b41bdbc2	有線電気通信設備令
f0cf4a3e20f38ed677493c80d45aad331bdd15d72be9e4ac5dad2e4d2d4e3987	有線電気通信設備令施行規則
1056f6342cdc61101b4a6c8d45dafd49606ab142feb6387a860b10036ee59fa5	有線電気通信法
36730e0c9a356039adfe9d1fd89d7050c5313fbef338949302428c4eef4cce78	有線電気通信法及び公衆電気通信法施行法
c7d92d38c06144c01287da4321630711a4cfbd8ae8e512d05bf79654fd491ff3	有線電気通信法施行規則
e143b1f4416d889c334e5ece31a99a9438b9256aa84b47f473612f18fd1800d1	有線電気通信法施行令
5e71dfc95cd0e0769708d2c799ec30150628c4b7bcb266871a96c81fb9e3ace8	郵便切手類販売所等に関する法律
d711b0570c2c688105b85b1f9b3163df3bf9445df0388fe37de0918aa1f7161b	郵便切手類模造等取締法
ea69cbf6fac0b4190f2eb425223651e7dd0710aa9ccf14c7ffeef6bb46343a7c	郵便切手類模造等の許可に関する省令
bfdae14e8e3a66866e0c199817ddaca6907b608876e539c8b29911c185c364d9	郵便貯金銀行及び郵便保険会社に係る移行期間中の業務の制限等に関する命令
f690bc3458259d8e504e82cd14a5e0c5c852a23c2b3d0c000e9cb613e6c7b25e	郵便貯金振興会の組織変更に伴う関係政令の整理等に関する政令　抄
5280666743f23e948c2c2824fbf2c0c14237592e06baea1055df04f7680db45c	郵便貯金法等の一部を改正する法律の施行に伴う経過措置を定める政令
893c354a3a4596e8b41555478ab039bc8d8b4ec4400bd5b0790efd447e3485a7	郵便物運送委託法
5420668c716a8569d9da3d64d5b6da1705fd18eb621512c10b78f74dc4529045	郵便法
3b053bc1bd5cf449968731ad41923792950ed9756c5c6948827f97fe3ef42d8c	郵便法施行規則
fa2ca28301cbba61b92e9d3af5d13708376838a1a70bc8387c0e60391dad4526	郵便法第七十三条の審議会等を定める政令
378f979824375569740d29cb623116d383f7a20310f208cac5070a259a3e658c	有料職業紹介事業保証金規則の廃止等に関する省令
02d839883719a5f6c712d51418f4f8ee0380476e47f781b3ee84936e5b13b935	優良自動車整備事業者認定規則
b2ed909fe33f25f098aef7a4d928d23c3ded037c1b2f24e01c1d23d000dd8f4e	優良田園住宅の建設の促進に関する法律
4d995b974d75acb9d7e4af7c705f2a5a609feac4f89a622055714893fd0256b7	優良田園住宅の建設の促進に関する法律施行規則
12d40598b727d46bd0de089a35c6a9eaf6efbf9cb632636d0aacc2bb61beca6f	優良田園住宅の建設の促進に関する法律施行令
ea8ed64a0c4e289d9261ce786cd327bd10324331cdc121189cbd34ca1d749cbb	優良田園住宅の建設の促進に関する法律第四条第五項に規定する農林水産大臣に対する協議に関する省令
82fe63c5e1584acdbe132193a582a1e554affa0f3ec7827e4048bb483d2fe0ae	有料道路自動料金収受システムを使用する料金徴収事務の取扱いに関する省令
c7e568dc52790c95b534173e85c1ef206344816a95a112e915e12300b075414b	行方不明者発見活動に関する規則
e11db4db20b5e3f2ba912a618a96159782e82c2b2e6a360a2c8a1edc6930dd03	輸出貨物が核兵器等の開発等のために用いられるおそれがある場合を定める省令
